StockCode,recommended_StockCode,recommended_Description,similarity_score,rank
20672,79190D,RETRO PLASTIC DAISY TRAY,0.2529,4
20672,79190A,RETRO PLASTIC 70'S TRAY,0.2449,5
20672,20820,SILVER LOOKING MIRROR,0.2353,6
20672,35597A,DUSTY PINK CHRISTMAS TREE 30CM,0.2329,7
20672,79320,FLAMINGO LIGHTS,0.2159,8
20672,35811A,ENAMEL PINK SUGAR CONTAINER,0.1993,9
20672,90130C,GREEN STONE/CRYSTAL EARRINGS,0.1841,10
20673,21081,SET/20 POSIES PAPER NAPKINS,0.4851,1
20673,10109,BENDY COLOUR PENCILS,0.2425,2
20673,16215,FUNKY GIRLZ MAGNETIC TO DO LIST,0.1903,3
20673,16245A,PINK MINI STATIONERY SET W CASE,0.1588,4
20673,21836,GINGHAM OVEN GLOVE RED HEART,0.1518,5
20673,81953B,ROUND ARTICULATED BLUE CLOCK W/SUCK,0.1516,6
20673,21489,BLUE WHITE SCARF HOT WATER BOTTLE,0.1345,7
20673,16012,FOOD/DRINK SPUNGE STICKERS,0.1333,8
20673,35597D,PINK/WHITE CHRISTMAS TREE 30CM,0.1168,9
20673,16156N,"WRAP, FRIENDSHIP ON GREEN",0.1113,10
20674,21245,GREEN  SPOTTY PLATE,0.8718,1
20674,21241,GREEN SPOTTY CUP,0.8543,2
20674,23125,6PC WOOD PLATE SET DISPOSABLE,0.8022,3
20674,20675,BLUE SPOTTY BOWL,0.7987,4
20674,21244,BLUE  SPOTTY PLATE,0.7512,5
20674,21239,PINK  SPOTTY CUP,0.7471,6
20674,77101A,UNION FLAG WINDSOCK,0.7466,7
20674,23435,3 RAFFIA RIBBONS VINTAGE CHRISTMAS,0.7442,8
20674,22270,HAPPY EASTER HANGING DECORATION,0.7432,9
20674,21240,BLUE  SPOTTY CUP,0.7425,10
20675,21244,BLUE  SPOTTY PLATE,0.9348,1
20675,21242,RED SPOTTY PLATE,0.8605,2
20675,21239,PINK  SPOTTY CUP,0.8427,3
20675,20677,PINK SPOTTY BOWL,0.8292,4
20675,21243,PINK  SPOTTY PLATE,0.8141,5
20675,20676,RED SPOTTY BOWL,0.811,6
20675,21240,BLUE  SPOTTY CUP,0.8081,7
20675,20674,GREEN SPOTTY BOWL,0.7987,8
20675,21238,RED SPOTTY CUP,0.7806,9
20675,21245,GREEN  SPOTTY PLATE,0.7651,10
20676,20677,PINK SPOTTY BOWL,0.9197,1
20676,20675,BLUE SPOTTY BOWL,0.811,2
20676,21243,PINK  SPOTTY PLATE,0.7978,3
20676,21242,RED SPOTTY PLATE,0.7677,4
20676,21080,SET/20 RED SPOTTY PAPER NAPKINS,0.7513,5
20676,21244,BLUE  SPOTTY PLATE,0.7402,6
20676,21094,SET/6 RED SPOTTY PAPER PLATES,0.7277,7
20676,21086,SET/6 RED SPOTTY PAPER CUPS,0.7197,8
20676,22090,PAPER BUNTING RETRO SPOTS,0.6726,9
20676,22333,RETRO SPORT PARTY BAG + STICKER SET,0.6628,10
20677,20676,RED SPOTTY BOWL,0.9197,1
20677,21243,PINK  SPOTTY PLATE,0.8621,2
20677,20675,BLUE SPOTTY BOWL,0.8292,3
20677,21242,RED SPOTTY PLATE,0.7951,4
20677,21244,BLUE  SPOTTY PLATE,0.7903,5
20677,21094,SET/6 RED SPOTTY PAPER PLATES,0.7808,6
20677,21086,SET/6 RED SPOTTY PAPER CUPS,0.759,7
20677,21080,SET/20 RED SPOTTY PAPER NAPKINS,0.7511,8
20677,22090,PAPER BUNTING RETRO SPOTS,0.736,9
20677,22333,RETRO SPORT PARTY BAG + STICKER SET,0.7332,10
20678,90076,MONTANA DIAMOND CLUSTER EARRINGS,1.0,1
20678,90141D,ROSE PENDANT TRIPLE SHELL NECKLACE,1.0,2
20678,90177A,CLASSIC DIAMANTE EARRINGS JET,0.9864,3
20678,84867A,PINK BABY GIRLS PHOTO ALBUM,0.9831,4
20678,90118,PINK DAISY BAG CHARM,0.9733,5
20678,90177E,DROP DIAMANTE EARRINGS GREEN,0.9733,6
20678,90202A,PURPLE ENAMEL FLOWER HAIR TIE,0.9733,7
20678,90101,WHITE FRANGIPANI NECKLACE,0.9701,8
20678,35912B,WHITE/PINK CHICK DECORATION,0.9612,9
20678,90202C,GREEN ENAMEL FLOWER HAIR TIE,0.9608,10
20679,21955,UNION JACK GUNS & ROSES  DOORMAT,0.9234,1
20679,15056P,EDWARDIAN PARASOL PINK,0.9203,2
20679,84925A,WAKE UP COCKEREL WALL THERMOMETER,0.9173,3
20679,22189,CREAM HEART CARD HOLDER,0.9127,4
20679,22660,DOORMAT I LOVE LONDON,0.9118,5
20679,85014A,BLACK/BLUE DOTS RUFFLED UMBRELLA,0.9115,6
20679,85014D,PINK/BROWN DOTS RUFFLED UMBRELLA,0.9111,7
20679,21000,ROSE DU SUD COSMETICS BAG,0.9087,8
20679,22188,BLACK HEART CARD HOLDER,0.9087,9
20679,21444,BLUE CHALET BIRDFEEDER,0.9082,10
20680,84795E,RIO PINK STRIPE HAMMOCK,0.275,1
20680,21034,REX CASH+CARRY JUMBO SHOPPER,0.2612,2
20680,16161M,WRAP  PINK FLOCK,0.2218,3
20680,46775D,SUNSET COLOUR CHUNKY KNITTED THROW,0.2067,4
20680,90037A,TINY CRYSTAL BRACELET RED,0.1806,5
20680,35598C,WHITE CHRISTMAS TREE 60CM,0.1667,6
20680,10124A,SPOTS ON RED BOOKCOVER TAPE,0.15,7
20680,20968,GREEN FLORAL FELTCRAFT SHOULDER BAG,0.1491,8
20680,21372,MIRRORED WALL ART TABLE LAMP,0.1465,9
20680,90036E,"FLOWER GLASS GARLD NECKL36""AMETHYST",0.1369,10
20681,20715,LITTLE FLOWER SHOPPER BAG,0.8161,1
20681,20913,SET/5 BLUE SPOTTY LID GLASS BOWLS,0.8138,2
20681,37345,ASSTD HEARTS DESIGN MUGS,0.8129,3
20681,22936,BAKING MOULD ROSE WHITE CHOCOLATE,0.8124,4
20681,23046,PAPER LANTERN 9 POINT DELUXE STAR,0.8119,5
20681,84798A,PINK FOXGLOVE ARTIIFCIAL FLOWER,0.8102,6
20681,21438,TUB 24 HANGING EASTER EGGS SPOTTY,0.8101,7
20681,84849D,HOT BATHS SOAP HOLDER,0.8079,8
20681,21477,STRING OF 20 ROSE LIGHTS,0.807,9
20681,22204,MILK PAN BLUE RETROSPOT,0.8029,10
20682,20681,PINK SPOTTY CHILDS UMBRELLA,0.6931,1
20682,84798B,PURPLE FOXGLOVE ARTIIFCIAL FLOWER,0.6178,2
20682,23010,CIRCUS PARADE BABY GIFT SET,0.6172,3
20682,22323,PINK POLKADOT KIDS BAG,0.6142,4
20682,17084R,ASSORTED INCENSE PACK,0.614,5
20682,21903,MAN FLU METAL SIGN,0.6121,6
20682,20715,LITTLE FLOWER SHOPPER BAG,0.5993,7
20682,21169,YOU'RE CONFUSING ME METAL SIGN,0.5985,8
20682,20913,SET/5 BLUE SPOTTY LID GLASS BOWLS,0.5982,9
20682,20754,RETRO RED SPOTTY WASHING UP GLOVES,0.5972,10
20683,35976B,WHITE SCANDINAVIAN HEART CHRISTMAS,1.0,1
20683,21726,MULTI HEARTS  STICKERS,0.5279,2
20683,90214K,"LETTER ""K"" BLING KEY RING",0.5197,3
20683,17090D,VANILLA INCENSE 40 CONES IN TIN,0.5124,4
20683,21253,SET OF PICTURE FRAME  STICKERS,0.5119,5
20683,90214M,"LETTER ""M"" BLING KEY RING",0.4571,6
20683,84352,SILVER CHRISTMAS TREE BAUBLE STAND,0.4251,7
20683,21629,SQUARE FLOOR CUSHION VINTAGE PINK,0.4155,8
20683,85114C,RED ENCHANTED FOREST PLACEMAT,0.4144,9
20683,21894,POTTING SHED SEED ENVELOPES,0.4114,10
20684,22039,BOTANICAL LILY GIFT WRAP,0.5272,1
20684,23079,TOADSTOOL BEDSIDE LIGHT,0.4882,2
20684,23432,PRETTY HANGING QUILTED HEARTS,0.4813,3
20684,22808,SET OF 6 T-LIGHTS EASTER CHICKS,0.4695,4
20684,23112,PARISIENNE CURIO CABINET,0.3858,5
20684,22214,CANDLE PLATE LACE WHITE,0.377,6
20684,22674,FRENCH TOILET SIGN BLUE METAL,0.3658,7
20684,84247E,PACK/12 XMAS FUN CARD,0.3656,8
20684,21446,12 RED ROSE PEG PLACE SETTINGS,0.3619,9
20684,21285,RETRO SPOT CANDLE  MEDIUM,0.36,10
20685,48184,DOOR MAT ENGLISH ROSE,0.9507,1
20685,48187,DOOR MAT NEW ENGLAND,0.8998,2
20685,48116,DOOR MAT MULTICOLOUR STRIPE,0.8989,3
20685,48129,DOOR MAT TOPIARY,0.8725,4
20685,48194,DOORMAT HEARTS,0.8664,5
20685,21872,GLAMOROUS  MUG,0.8619,6
20685,85041,SET/4 PINK ORCHID CANDLES IN BOWL,0.8606,7
20685,21524,SPOTTY  HOME SWEET HOME DOORMAT,0.8532,8
20685,22304,COFFEE MUG BLUE PAISLEY DESIGN,0.8498,9
20685,21523,FANCY FONT HOME SWEET HOME DOORMAT,0.8461,10
20686,20681,PINK SPOTTY CHILDS UMBRELLA,0.4007,1
20686,22312,OFFICE MUG WARMER POLKADOT,0.3344,2
20686,20682,RED SPOTTY CHILDS UMBRELLA,0.3337,3
20686,84597C,RETRO PINK BALL ASHTRAY,0.3322,4
20686,20854,BLUE PATCH PURSE PINK HEART,0.3241,5
20686,23186,FRENCH STYLE STORAGE JAR CAFE,0.2941,6
20686,22198,"POPCORN HOLDER , LARGE",0.2827,7
20686,21719,LOVELY BONBON STICKER SHEET,0.2821,8
20686,20751,FUNKY WASHING UP GLOVES ASSORTED,0.2764,9
20686,20684,STRAWBERRY DREAM CHILDS UMBRELLA,0.2696,10
20688,37351,ORANGE FLOWER MUG,0.9981,1
20688,20800,LARGE GLASS SUNDAE DISH CLEAR,0.9981,2
20688,37352,BIRD IN TREE MUG,0.9981,3
20688,47503E,ASS FLORAL PRINT SCISSORS,0.9981,4
20688,37379B,BLUE CHERRY BLOSSOM CUP & SAUCER,0.9981,5
20688,16044,POP-ART FLUORESCENT PENS,0.9981,6
20688,20776,ABSTRACT CIRCLES NOTEBOOK,0.9981,7
20688,20775,DAISY NOTEBOOK,0.9981,8
20688,21092,SET/6 STRAWBERRY PAPER PLATES,0.998,9
20688,20774,GREEN FERN NOTEBOOK,0.998,10
20689,20778,GARDEN PATH NOTEBOOK,0.9971,1
20689,47503E,ASS FLORAL PRINT SCISSORS,0.9971,2
20689,20729,RED SPOTTY CANDY BAG,0.9971,3
20689,37351,ORANGE FLOWER MUG,0.997,4
20689,20800,LARGE GLASS SUNDAE DISH CLEAR,0.997,5
20689,37352,BIRD IN TREE MUG,0.997,6
20689,20776,ABSTRACT CIRCLES NOTEBOOK,0.997,7
20689,20773,BLUE PAISLEY NOTEBOOK,0.997,8
20689,37379B,BLUE CHERRY BLOSSOM CUP & SAUCER,0.997,9
20689,20775,DAISY NOTEBOOK,0.997,10
20692,23509,MINI PLAYING CARDS FUN FAIR,0.91,1
20692,84952B,BLACK LOVE BIRD T-LIGHT HOLDER,0.8894,2
20692,84952C,MIRROR LOVE BIRD T-LIGHT HOLDER,0.8874,3
20692,85040B,SET/4 BLUE FLOWER CANDLES IN BOWL,0.8846,4
20692,37461,FUNKY MONKEY MUG,0.8841,5
20692,22453,MEASURING TAPE RUSSIAN DOLL BLUE,0.8836,6
20692,22752,SET 7 BABUSHKA NESTING BOXES,0.8834,7
20692,20814,SILVER FINCH DECORATION,0.8819,8
20692,20825,GOLD WINE GLASS,0.8806,9
20692,23382,BOX OF 6 CHRISTMAS CAKE DECORATIONS,0.8731,10
20693,20678,LARGE BLACK DIAMANTE HAIRSLIDE,0.5941,1
20693,90076,MONTANA DIAMOND CLUSTER EARRINGS,0.5941,2
20693,90141D,ROSE PENDANT TRIPLE SHELL NECKLACE,0.5941,3
20693,90177A,CLASSIC DIAMANTE EARRINGS JET,0.586,4
20693,84867A,PINK BABY GIRLS PHOTO ALBUM,0.584,5
20693,90118,PINK DAISY BAG CHARM,0.5782,6
20693,90177E,DROP DIAMANTE EARRINGS GREEN,0.5782,7
20693,90202A,PURPLE ENAMEL FLOWER HAIR TIE,0.5782,8
20693,90101,WHITE FRANGIPANI NECKLACE,0.5764,9
20693,35912B,WHITE/PINK CHICK DECORATION,0.5717,10
20694,20695,FLORAL BLUE MONSTER,0.7772,1
20694,35915A,CREAM KNITTED HEN,0.7541,2
20694,35961,FOLKART ZINC HEART CHRISTMAS DEC,0.752,3
20694,23446,BLUE BUNNY EASTER EGG BASKET,0.7514,4
20694,23447,PINK BUNNY EASTER EGG BASKET,0.7514,5
20694,35915C,PEACH KNITTED HEN,0.7514,6
20694,22243,"HOOK, 5 HANGER ,MAGIC TOADSTOOL RED",0.7511,7
20694,23440,PAINT YOUR OWN EGGS IN CRATE,0.7508,8
20694,22131,FOOD CONTAINER SET 3 LOVE HEART,0.7506,9
20694,35915B,BLUE KNITTED HEN,0.7497,10
20695,35915A,CREAM KNITTED HEN,0.8469,1
20695,35961,FOLKART ZINC HEART CHRISTMAS DEC,0.8446,2
20695,23446,BLUE BUNNY EASTER EGG BASKET,0.844,3
20695,23447,PINK BUNNY EASTER EGG BASKET,0.844,4
20695,35915C,PEACH KNITTED HEN,0.8439,5
20695,22243,"HOOK, 5 HANGER ,MAGIC TOADSTOOL RED",0.8434,6
20695,23440,PAINT YOUR OWN EGGS IN CRATE,0.8432,7
20695,22131,FOOD CONTAINER SET 3 LOVE HEART,0.8431,8
20695,35915B,BLUE KNITTED HEN,0.8421,9
20695,22856,ASSORTED EASTER DECORATIONS  BELLS,0.8407,10
20696,21681,GIANT MEDINA STAMPED METAL BOWL,0.4956,1
20696,85232D,SET/3 DECOUPAGE STACKING TINS,0.4893,2
20696,22393,PAPERWEIGHT VINTAGE COLLAGE,0.4816,3
20696,22254,FELT TOADSTOOL LARGE,0.4781,4
20696,21223,SET/4 BADGES WOODLAND ANIMAL,0.4757,5
20696,22554,PLASTERS IN TIN WOODLAND ANIMALS,0.4688,6
20696,22595,CHRISTMAS GINGHAM HEART,0.4676,7
20696,22325,MOBILE VINTAGE HEARTS,0.4675,8
20696,22483,RED GINGHAM TEDDY BEAR,0.4656,9
20696,84459B,YELLOW METAL CHICKEN HEART,0.4649,10
20697,20698,LITTLE PINK MONSTER SOFT TOY,0.8643,1
20697,20699,MOUSEY LONG LEGS SOFT TOY,0.5156,2
20697,85089,CANDY SPOT BUNNY,0.5143,3
20697,84902,PINK KNITTED COW STUFFED TOY,0.4585,4
20697,84578,ELEPHANT TOY WITH BLUE T-SHIRT,0.4409,5
20697,84901,BLACK FACE LAMB WITH PANTS,0.401,6
20697,22250,DECORATION  BUTTERFLY  MAGIC GARDEN,0.3034,7
20697,20695,FLORAL BLUE MONSTER,0.2894,8
20697,84920,PINK FLOWER FABRIC PONY,0.2638,9
20697,21031,SPACE CADET BLACK,0.255,10
20698,20697,LITTLE GREEN MONSTER SOFT TOY,0.8643,1
20698,20699,MOUSEY LONG LEGS SOFT TOY,0.4817,2
20698,85089,CANDY SPOT BUNNY,0.478,3
20698,84902,PINK KNITTED COW STUFFED TOY,0.4146,4
20698,84578,ELEPHANT TOY WITH BLUE T-SHIRT,0.4074,5
20698,84901,BLACK FACE LAMB WITH PANTS,0.3431,6
20698,22250,DECORATION  BUTTERFLY  MAGIC GARDEN,0.2929,7
20698,20695,FLORAL BLUE MONSTER,0.274,8
20698,84581,DOG TOY WITH PINK CROCHET SKIRT,0.27,9
20698,84920,PINK FLOWER FABRIC PONY,0.2498,10
20699,85089,CANDY SPOT BUNNY,0.5541,1
20699,20697,LITTLE GREEN MONSTER SOFT TOY,0.5156,2
20699,20698,LITTLE PINK MONSTER SOFT TOY,0.4817,3
20699,90197B,BLACK GLASS BRACELET W HEART CHARMS,0.4087,4
20699,84578,ELEPHANT TOY WITH BLUE T-SHIRT,0.366,5
20699,84902,PINK KNITTED COW STUFFED TOY,0.3321,6
20699,84581,DOG TOY WITH PINK CROCHET SKIRT,0.3185,7
20699,20703,BLUE PADDED SOFT MOBILE,0.3161,8
20699,22266,EASTER DECORATION HANGING BUNNY,0.3115,9
20699,21173,LOO ROLL  METAL SIGN,0.3094,10
20700,35816B,"ACRYLIC JEWEL ANGEL,BLUE",0.9943,1
20700,17011C,ORIGAMI LAVENDER INCENSE+FLOWER,0.9943,2
20700,17011E,ORIGAMI OPIUM SCENT INCENSE+FLOWER,0.9943,3
20700,22864,MUG AND COASTER SET RED CIRCLES,0.9943,4
20700,35822B,"ACRYLIC BEAD CHAIN, BLUE",0.9943,5
20700,35822P,"ACRYLIC BEAD CHAIN, PINK",0.9943,6
20700,79308B,MOSAIC CANDLE DISH BLUE PURPLE,0.9943,7
20700,84857B,BLUE MONTE CARLO HANDBAG,0.9943,8
20700,84908B,BLUE 5 PATCH FLOWER CUSHION COVER,0.9943,9
20700,84908A,PINK 5 PATCH FLOWER CUSHION COVER,0.9943,10
20701,17011C,ORIGAMI LAVENDER INCENSE+FLOWER,0.9946,1
20701,17011E,ORIGAMI OPIUM SCENT INCENSE+FLOWER,0.9946,2
20701,22864,MUG AND COASTER SET RED CIRCLES,0.9946,3
20701,35822B,"ACRYLIC BEAD CHAIN, BLUE",0.9946,4
20701,35822P,"ACRYLIC BEAD CHAIN, PINK",0.9946,5
20701,79308B,MOSAIC CANDLE DISH BLUE PURPLE,0.9946,6
20701,84857B,BLUE MONTE CARLO HANDBAG,0.9946,7
20701,84908B,BLUE 5 PATCH FLOWER CUSHION COVER,0.9946,8
20701,84908A,PINK 5 PATCH FLOWER CUSHION COVER,0.9946,9
20701,35817B,"ACRYLIC JEWEL SNOWFLAKE,BLUE",0.9946,10
20702,20703,BLUE PADDED SOFT MOBILE,0.7682,1
20702,85055,FRENCH ENAMEL UTENSIL HOLDER,0.4216,2
20702,20964,POLYESTER FILLER PAD 60X40CM,0.399,3
20702,20696,FLORAL SOFT CAR TOY,0.3805,4
20702,20683,RAIN GIRL CHILDS UMBRELLA,0.372,5
20702,35976B,WHITE SCANDINAVIAN HEART CHRISTMAS,0.372,6
20702,84199,GLOW IN DARK DOLPHINS,0.361,7
20702,21253,SET OF PICTURE FRAME  STICKERS,0.3438,8
20702,23054,RECYCLED ACAPULCO MAT LAVENDER,0.3094,9
20702,20678,LARGE BLACK DIAMANTE HAIRSLIDE,0.2976,10
20703,20702,PINK PADDED MOBILE,0.7682,1
20703,20678,LARGE BLACK DIAMANTE HAIRSLIDE,0.5022,2
20703,90076,MONTANA DIAMOND CLUSTER EARRINGS,0.5022,3
20703,90141D,ROSE PENDANT TRIPLE SHELL NECKLACE,0.5022,4
20703,90177A,CLASSIC DIAMANTE EARRINGS JET,0.4953,5
20703,84867A,PINK BABY GIRLS PHOTO ALBUM,0.4937,6
20703,90118,PINK DAISY BAG CHARM,0.4888,7
20703,90177E,DROP DIAMANTE EARRINGS GREEN,0.4888,8
20703,90202A,PURPLE ENAMEL FLOWER HAIR TIE,0.4888,9
20703,85055,FRENCH ENAMEL UTENSIL HOLDER,0.4885,10
20704,20705,MRS ROBOT SOFT TOY,0.9044,1
20704,84689,S/2 BEACH HUT TREASURE CHESTS,0.7938,2
20704,46776C,WOVEN FROST CUSHION COVER,0.7928,3
20704,17109A,FLOWER FAIRY INCENSE LILY,0.7827,4
20704,72225D,VANILLA SCENT CAKE CANDLE,0.7826,5
20704,85144,JARDIN ETCHED GLASS BUTTER DISH,0.7799,6
20704,85031C,CURIOUS IMAGES SCRAP BOOK SET,0.7782,7
20704,84631,FRUIT TREE AND BIRDS WALL PLAQUE,0.7742,8
20704,84869,CANDY BUTTON PHOTO ALBUM,0.7737,9
20704,72754A,FLOWER FAIRY POTPOURRI CUSHION LILY,0.773,10
20705,20704,MR ROBOT SOFT TOY,0.9044,1
20705,84689,S/2 BEACH HUT TREASURE CHESTS,0.8184,2
20705,46776C,WOVEN FROST CUSHION COVER,0.8174,3
20705,17109A,FLOWER FAIRY INCENSE LILY,0.807,4
20705,72225D,VANILLA SCENT CAKE CANDLE,0.8068,5
20705,85031C,CURIOUS IMAGES SCRAP BOOK SET,0.8003,6
20705,84631,FRUIT TREE AND BIRDS WALL PLAQUE,0.7981,7
20705,84869,CANDY BUTTON PHOTO ALBUM,0.7978,8
20705,20701,PINK CAT FLORAL CUSHION COVER,0.7972,9
20705,72754A,FLOWER FAIRY POTPOURRI CUSHION LILY,0.797,10
20707,21946,PARTY TIME DESIGN FLANNEL,0.9288,1
20707,84748,FOLK FELT HANGING MULTICOL GARLAND,0.919,2
20707,72753A,S/3 FLWR FAIRY LILLY CANDLES,0.8882,3
20707,85024B,EAU DE NILE JEWELLED PHOTOFRAME,0.8866,4
20707,20888,SET 3 JARDIN DE FEMME SCENT CANDLES,0.8843,5
20707,20619,TROPICAL PASSPORT COVER,0.8808,6
20707,47587A,PINK FAIRY CAKE COASTER,0.8804,7
20707,84908A,PINK 5 PATCH FLOWER CUSHION COVER,0.8804,8
20707,17011C,ORIGAMI LAVENDER INCENSE+FLOWER,0.8804,9
20707,17011E,ORIGAMI OPIUM SCENT INCENSE+FLOWER,0.8804,10
20711,20713,JUMBO BAG OWLS,0.8782,1
20711,85099F,JUMBO BAG STRAWBERRY,0.8603,2
20711,22385,JUMBO BAG SPACEBOY DESIGN,0.8109,3
20711,22386,JUMBO BAG PINK WITH WHITE SPOTS,0.7566,4
20711,23199,JUMBO BAG APPLES,0.7404,5
20711,84519A,TOMATO CHARLIE+LOLA COASTER SET,0.7401,6
20711,85099B,JUMBO BAG RED WHITE SPOTTY,0.7351,7
20711,23201,JUMBO BAG ALPHABET,0.7316,8
20711,22389,PAPERWEIGHT SAVE THE PLANET,0.6953,9
20711,85099C,JUMBO  BAG BAROQUE BLACK WHITE,0.6926,10
20712,22242,"HOOK, 5 HANGER , MAGIC TOADSTOOL",0.8641,1
20712,22243,"HOOK, 5 HANGER ,MAGIC TOADSTOOL RED",0.8471,2
20712,20719,WOODLAND CHARLOTTE BAG,0.8456,3
20712,35915A,CREAM KNITTED HEN,0.8456,4
20712,22326,"ROUND SNACK BOXES ,SET4, WOODLAND",0.8452,5
20712,21559,STRAWBERRY LUNCHBOX WITH CUTLERY,0.844,6
20712,35915B,BLUE KNITTED HEN,0.8437,7
20712,22131,FOOD CONTAINER SET 3 LOVE HEART,0.8437,8
20712,21432,SET OF 3 CASES WOODLAND DESIGN,0.8436,9
20712,35961,FOLKART ZINC HEART CHRISTMAS DEC,0.8435,10
20713,22385,JUMBO BAG SPACEBOY DESIGN,0.8894,1
20713,20711,JUMBO BAG TOYS,0.8782,2
20713,23199,JUMBO BAG APPLES,0.8714,3
20713,85099F,JUMBO BAG STRAWBERRY,0.8597,4
20713,22386,JUMBO BAG PINK WITH WHITE SPOTS,0.841,5
20713,23201,JUMBO BAG ALPHABET,0.8294,6
20713,85099C,JUMBO  BAG BAROQUE BLACK WHITE,0.8078,7
20713,85099B,JUMBO BAG RED WHITE SPOTTY,0.7795,8
20713,21928,JUMBO BAG SCANDINAVIAN PAISLEY,0.7706,9
20713,21929,JUMBO BAG PINK VINTAGE PAISLEY,0.7551,10
20714,21581,SKULLS  DESIGN  COTTON TOTE BAG,0.9024,1
20714,51020B,STRIPY DESIGN SHOWER CAP,0.8708,2
20714,84720,DOT MATRIX CANVAS ART PICTURE,0.8677,3
20714,16207B,PINK HEART RED HANDBAG,0.8632,4
20714,21579,LOLITA  DESIGN  COTTON TOTE BAG,0.8604,5
20714,17013C,ORIGAMI LAVENDER INCENSE IN TUBE,0.8598,6
20714,21946,PARTY TIME DESIGN FLANNEL,0.8525,7
20714,84509E,CAROUSEL PLACEMATS,0.8489,8
20714,22104,MIRROR MOSAIC CANDLE PLATE,0.8475,9
20714,72225D,VANILLA SCENT CAKE CANDLE,0.8321,10
20715,37345,ASSTD HEARTS DESIGN MUGS,0.9959,1
20715,20913,SET/5 BLUE SPOTTY LID GLASS BOWLS,0.9954,2
20715,84798A,PINK FOXGLOVE ARTIIFCIAL FLOWER,0.9928,3
20715,23046,PAPER LANTERN 9 POINT DELUXE STAR,0.9924,4
20715,21438,TUB 24 HANGING EASTER EGGS SPOTTY,0.9858,5
20715,22936,BAKING MOULD ROSE WHITE CHOCOLATE,0.9811,6
20715,21477,STRING OF 20 ROSE LIGHTS,0.9801,7
20715,23040,PAPER LANTERN 9 POINT SNOW STAR,0.9762,8
20715,84849D,HOT BATHS SOAP HOLDER,0.9696,9
20715,21593,SWALLOW CIGAR BOX MATCHES,0.9645,10
20716,21109,"LARGE CAKE TOWEL, CHOCOLATE SPOTS",0.5575,1
20716,84509G,FAIRY CAKE PLACEMATS,0.5019,2
20716,35924,HANGING FAIRY CAKE DECORATION,0.5002,3
20716,84596I,WRAP SWEETS LIGHT PINK SMALL BOWL,0.4974,4
20716,21110,LARGE CAKE TOWEL PINK SPOTS,0.4954,5
20716,47570B,TEA TIME TABLE CLOTH,0.4904,6
20716,85091,CANDY SPOT BREAD BASKETS,0.4828,7
20716,21231,SWEETHEART CERAMIC TRINKET BOX,0.4769,8
20716,37450,CERAMIC CAKE BOWL + HANGING CAKES,0.4719,9
20716,22064,PINK DOUGHNUT TRINKET POT,0.4627,10
20717,22474,SPACEBOY TV DINNER TRAY,0.7123,1
20717,23205,CHARLOTTE BAG VINTAGE ALPHABET,0.7053,2
20717,20718,RED SPOTTY SHOPPER BAG,0.7025,3
20717,22472,TV DINNER TRAY DOLLY GIRL,0.6937,4
20717,23164,REGENCY CAKE SLICE,0.6911,5
20717,22967,SET 3 SONG BIRD PAPER EGGS ASSORTED,0.685,6
20717,23008,DOLLY GIRL BABY GIFT SET,0.6726,7
20717,22674,FRENCH TOILET SIGN BLUE METAL,0.667,8
20717,23028,DRAWER KNOB CRACKLE GLAZE BLUE,0.6668,9
20717,22483,RED GINGHAM TEDDY BEAR,0.6629,10
20718,23205,CHARLOTTE BAG VINTAGE ALPHABET,0.8256,1
20718,22592,CARDHOLDER HOLLY WREATH METAL,0.8074,2
20718,22356,"CHARLOTTE BAG , PINK/WHITE SPOTS",0.7973,3
20718,20724,RED SPOTTY CHARLOTTE BAG,0.7963,4
20718,22908,PACK OF 20 NAPKINS RED APPLES,0.7938,5
20718,22505,MEMO BOARD COTTAGE DESIGN,0.793,6
20718,22244,"HOOK, 3 HANGER ,MAGIC GARDEN",0.793,7
20718,22243,"HOOK, 5 HANGER ,MAGIC TOADSTOOL RED",0.7908,8
20718,35915A,CREAM KNITTED HEN,0.7859,9
20718,35961,FOLKART ZINC HEART CHRISTMAS DEC,0.7859,10
20719,21559,STRAWBERRY LUNCHBOX WITH CUTLERY,0.9221,1
20719,22356,"CHARLOTTE BAG , PINK/WHITE SPOTS",0.9167,2
20719,22630,DOLLY GIRL LUNCH BOX,0.9154,3
20719,22629,SPACEBOY LUNCH BOX,0.9146,4
20719,22326,"ROUND SNACK BOXES ,SET4, WOODLAND",0.9126,5
20719,21432,SET OF 3 CASES WOODLAND DESIGN,0.9094,6
20719,22243,"HOOK, 5 HANGER ,MAGIC TOADSTOOL RED",0.9043,7
20719,35961,FOLKART ZINC HEART CHRISTMAS DEC,0.9043,8
20719,22242,"HOOK, 5 HANGER , MAGIC TOADSTOOL",0.9032,9
20719,35915A,CREAM KNITTED HEN,0.9032,10
20721,20620,RED SPOTTY PASSPORT COVER,1.0,1
20721,35945,GOLD CHRISTMAS STOCKING DECORATION,1.0,2
20721,84311,CAMOFLAGE CUSHION COVER,1.0,3
20721,85043,RED HEART CANDY POP LIGHTS,1.0,4
20721,85171,S/2 HYACINTH BULB CANDLES,1.0,5
20721,84030C,KNITTED RAINBOW HOT WATER BOTTLE,0.9431,6
20721,85095,THREE CANVAS LUGGAGE TAGS,0.8572,7
20721,84030B,KNITTED POM POM HOT WATER BOTTLE,0.8321,8
20721,21927,BLUE/CREAM STRIPE CUSHION COVER,0.8254,9
20721,85225,BLING KEY RING STAND,0.8193,10
20723,20724,RED SPOTTY CHARLOTTE BAG,0.8734,1
20723,22356,"CHARLOTTE BAG , PINK/WHITE SPOTS",0.7675,2
20723,23204,CHARLOTTE BAG APPLES DESIGN,0.7452,3
20723,22661,CHARLOTTE BAG DOLLY GIRL DESIGN,0.7348,4
20723,20719,WOODLAND CHARLOTTE BAG,0.7319,5
20723,23205,CHARLOTTE BAG VINTAGE ALPHABET,0.694,6
20723,22663,JUMBO BAG DOLLY GIRL DESIGN,0.6819,7
20723,22378,WALL TIDY RETROSPOT,0.6768,8
20723,22242,"HOOK, 5 HANGER , MAGIC TOADSTOOL",0.6715,9
20723,21559,STRAWBERRY LUNCHBOX WITH CUTLERY,0.6682,10
20724,22356,"CHARLOTTE BAG , PINK/WHITE SPOTS",0.9398,1
20724,23204,CHARLOTTE BAG APPLES DESIGN,0.913,2
20724,22661,CHARLOTTE BAG DOLLY GIRL DESIGN,0.9075,3
20724,20719,WOODLAND CHARLOTTE BAG,0.9028,4
20724,35961,FOLKART ZINC HEART CHRISTMAS DEC,0.8958,5
20724,22243,"HOOK, 5 HANGER ,MAGIC TOADSTOOL RED",0.8958,6
20724,35915A,CREAM KNITTED HEN,0.8945,7
20724,23281,FOLDING BUTTERFLY MIRROR RED,0.8939,8
20724,22131,FOOD CONTAINER SET 3 LOVE HEART,0.8937,9
20724,22326,"ROUND SNACK BOXES ,SET4, WOODLAND",0.8929,10
20725,22384,LUNCHBAG PINK RETROSPOT,0.8119,1
20725,21937,STRAWBERRY   PICNIC BAG,0.7691,2
20725,22382,LUNCHBAG SPACEBOY DESIGN,0.6957,3
20725,20718,RED SPOTTY SHOPPER BAG,0.6795,4
20725,23205,CHARLOTTE BAG VINTAGE ALPHABET,0.6749,5
20725,22908,PACK OF 20 NAPKINS RED APPLES,0.6683,6
20725,22628,PICNIC BOXES SET OF 3 RETROSPOT,0.6646,7
20725,22378,WALL TIDY RETROSPOT,0.662,8
20725,20724,RED SPOTTY CHARLOTTE BAG,0.6603,9
20725,21936,RED/WHITE SPOT PICNIC BAG,0.6598,10
20726,20728,LUNCH BAG CARS BLUE,0.8405,1
20726,20727,LUNCH BAG  BLACK SKULL.,0.8051,2
20726,21559,STRAWBERRY LUNCHBOX WITH CUTLERY,0.641,3
20726,23204,CHARLOTTE BAG APPLES DESIGN,0.6386,4
20726,22356,"CHARLOTTE BAG , PINK/WHITE SPOTS",0.6383,5
20726,23256,CHILDRENS CUTLERY SPACEBOY,0.6377,6
20726,20712,JUMBO BAG WOODLAND ANIMALS,0.6377,7
20726,23205,CHARLOTTE BAG VINTAGE ALPHABET,0.6377,8
20726,22326,"ROUND SNACK BOXES ,SET4, WOODLAND",0.6368,9
20726,22242,"HOOK, 5 HANGER , MAGIC TOADSTOOL",0.6326,10
20727,20728,LUNCH BAG CARS BLUE,0.8407,1
20727,20726,LUNCH BAG WOODLAND,0.8051,2
20727,20725,LUNCH BAG RED SPOTTY,0.5512,3
20727,22384,LUNCHBAG PINK RETROSPOT,0.5173,4
20727,22383,LUNCHBAG SUKI  DESIGN,0.4942,5
20727,21930,JUMBO STORAGE BAG SKULLS,0.4555,6
20727,21936,RED/WHITE SPOT PICNIC BAG,0.4054,7
20727,23209,LUNCH BAG DOILEY PATTERN,0.4044,8
20727,22382,LUNCHBAG SPACEBOY DESIGN,0.404,9
20727,22378,WALL TIDY RETROSPOT,0.3972,10
20728,20727,LUNCH BAG  BLACK SKULL.,0.8407,1
20728,20726,LUNCH BAG WOODLAND,0.8405,2
20728,20725,LUNCH BAG RED SPOTTY,0.5915,3
20728,21937,STRAWBERRY   PICNIC BAG,0.5238,4
20728,22384,LUNCHBAG PINK RETROSPOT,0.5159,5
20728,21932,SCANDINAVIAN PAISLEY PICNIC BAG,0.4743,6
20728,22474,SPACEBOY TV DINNER TRAY,0.4683,7
20728,21933,PINK VINTAGE PAISLEY PICNIC BAG,0.4609,8
20728,22377,BOTTLE BAG RETROSPOT,0.4584,9
20728,22472,TV DINNER TRAY DOLLY GIRL,0.4537,10
20729,37351,ORANGE FLOWER MUG,0.9998,1
20729,20800,LARGE GLASS SUNDAE DISH CLEAR,0.9998,2
20729,47503E,ASS FLORAL PRINT SCISSORS,0.9998,3
20729,20776,ABSTRACT CIRCLES NOTEBOOK,0.9998,4
20729,37352,BIRD IN TREE MUG,0.9998,5
20729,16044,POP-ART FLUORESCENT PENS,0.9997,6
20729,37379B,BLUE CHERRY BLOSSOM CUP & SAUCER,0.9997,7
20729,20775,DAISY NOTEBOOK,0.9997,8
20729,20774,GREEN FERN NOTEBOOK,0.9997,9
20729,21092,SET/6 STRAWBERRY PAPER PLATES,0.9997,10
20730,20729,RED SPOTTY CANDY BAG,0.9989,1
20730,20653,CHERRY BLOSSOM LUGGAGE TAG,0.9988,2
20730,85218,S/5 MINI ICE CREAM FRIDGE MAGNETS,0.9987,3
20730,47504E,ENGLISH ROSE SCISSORS,0.9987,4
20730,37351,ORANGE FLOWER MUG,0.9987,5
20730,20800,LARGE GLASS SUNDAE DISH CLEAR,0.9987,6
20730,37352,BIRD IN TREE MUG,0.9987,7
20730,47503E,ASS FLORAL PRINT SCISSORS,0.9987,8
20730,37379B,BLUE CHERRY BLOSSOM CUP & SAUCER,0.9987,9
20730,16044,POP-ART FLUORESCENT PENS,0.9987,10
20731,20657,TROPICAL LUGGAGE TAG,0.9885,1
20731,20993,JAZZ HEARTS MEMO PAD,0.9876,2
20731,17109C,FLOWER FAIRY INCENSE ROSE,0.9789,3
20731,17109B,FLOWER FAIRY INCENSE LAVENDER,0.9777,4
20731,20730,STRAWBERRY CANDY BAG,0.9775,5
20731,20652,BLUE SPOTTY LUGGAGE TAG,0.9764,6
20731,20729,RED SPOTTY CANDY BAG,0.9756,7
20731,20653,CHERRY BLOSSOM LUGGAGE TAG,0.9753,8
20731,85198,ASSORTED FARMYARD ANIMALS IN BUCKET,0.9751,9
20731,47504E,ENGLISH ROSE SCISSORS,0.9749,10
20733,20734,SILVER MINI TAPE MEASURE,0.9345,1
20733,85050,FRENCH ENAMEL SOAP DISH WITH LID,0.9295,2
20733,22811,SET OF 6 T-LIGHTS CACTI,0.9238,3
20733,20738,GREEN MINI TAPE MEASURE,0.9179,4
20733,71477,COLOUR GLASS. STAR T-LIGHT HOLDER,0.9019,5
20733,22686,"FRENCH BLUE METAL DOOR SIGN, NO",0.8882,6
20733,23460,SWEETHEART WALL TIDY,0.8677,7
20733,20735,BLACK MINI TAPE MEASURE,0.7912,8
20733,22168,"ORGANISER WOOD, ANTIQUE WHITE",0.7672,9
20733,23089,GLASS BON BON JAR,0.7533,10
20734,85050,FRENCH ENAMEL SOAP DISH WITH LID,0.9911,1
20734,22811,SET OF 6 T-LIGHTS CACTI,0.9852,2
20734,20738,GREEN MINI TAPE MEASURE,0.9803,3
20734,71477,COLOUR GLASS. STAR T-LIGHT HOLDER,0.9355,4
20734,20733,GOLD MINI TAPE MEASURE,0.9345,5
20734,22686,"FRENCH BLUE METAL DOOR SIGN, NO",0.9306,6
20734,23460,SWEETHEART WALL TIDY,0.9253,7
20734,22168,"ORGANISER WOOD, ANTIQUE WHITE",0.8148,8
20734,22801,ANTIQUE GLASS PEDESTAL BOWL,0.7907,9
20734,23089,GLASS BON BON JAR,0.7773,10
20735,20736,PINK MINI TAPE MEASURE,0.9383,1
20735,20733,GOLD MINI TAPE MEASURE,0.7912,2
20735,71477,COLOUR GLASS. STAR T-LIGHT HOLDER,0.7118,3
20735,85050,FRENCH ENAMEL SOAP DISH WITH LID,0.6993,4
20735,20734,SILVER MINI TAPE MEASURE,0.6966,5
20735,22811,SET OF 6 T-LIGHTS CACTI,0.6942,6
20735,20738,GREEN MINI TAPE MEASURE,0.688,7
20735,22686,"FRENCH BLUE METAL DOOR SIGN, NO",0.6567,8
20735,23460,SWEETHEART WALL TIDY,0.6514,9
