StockCode,recommended_StockCode,recommended_Description,similarity_score,rank
20882,20884,MODERN CHRISTMAS TREE CANDLE,0.7071,1
20882,79534,MULTICOLOUR GLASS PLATE,0.4842,2
20882,72771B,BURG FLOCK GOLD CUP/CANDLE,0.1624,3
20882,72083A,STRAWBERY SWIRL FLARE CANDLE,0.1543,4
20882,20877,MODERN CHRISTMAS BAUBLE CANDLE,0.1474,5
20882,17090D,VANILLA INCENSE 40 CONES IN TIN,0.1025,6
20882,84555A,YELLOW VW BEETLE CERAMIC MONEY BOX,0.0535,7
20882,72122,COFFEE SCENT PILLAR CANDLE,0.0344,8
20882,84437A,S/6 PINK EASTER DECS IN BOX,0.0334,9
20882,85025B,EAU DE NILE HEART SHAPE PHOTO FRAME,0.0312,10
20884,20881,MODERN CHRISTMAS TREE CANDLE,0.7071,1
20884,20882,MODERN CHRISTMAS TREE CANDLE,0.7071,2
20884,85083,KISS REINDEER SCANDINAVIAN STOCKING,0.5883,3
20884,84247H,PACK/12 DECOUPAGE CARD,0.5779,4
20884,20942,SET/6 GINGERBREAD TREE T-LIGHTS,0.4472,5
20884,20877,MODERN CHRISTMAS BAUBLE CANDLE,0.417,6
20884,35995,SET/6 BLACK GLITTER REINDEER CANDLE,0.3536,7
20884,79534,MULTICOLOUR GLASS PLATE,0.3424,8
20884,84251J,"GREETING CARD, THE BLACK CAT",0.2673,9
20884,16169C,WRAP BLUE REINDEER,0.2188,10
20885,10138,ASSORTED COLOUR JUMBO PEN,0.8995,1
20885,22124,SET OF 2 TEA TOWELS PING MICROWAVE,0.5042,2
20885,21685,MEDINA STAMPED METAL TRAY,0.4472,3
20885,84751B,BLACK MEDIUM GLASS CAKE STAND,0.3536,4
20885,20942,SET/6 GINGERBREAD TREE T-LIGHTS,0.3162,5
20885,16169F,WRAP BLIZZARD,0.2857,6
20885,85136A,YELLOW SHARK HELICOPTER,0.2638,7
20885,90190A,SILVER/CRYSTAL DROP EARRINGS W LEAF,0.254,8
20885,20976,12 PENCILS SMALL TUBE POSY,0.2097,9
20885,35931,PINK STAR CHRISTMAS DECORATION,0.197,10
20886,21743,STAR PORTABLE TABLE LIGHT,0.5154,1
20886,20893,HANGING BAUBLE T-LIGHT HOLDER SMALL,0.5116,2
20886,84255B,ORANGE COCKTAIL GLASS LAMP,0.5023,3
20886,35930,PINK HEART CHRISTMAS DECORATION,0.4079,4
20886,35974,S/6 CHRISTMAS TREE PLACE SETTING,0.4079,5
20886,90154,LAZER CUT NECKLACE W PASTEL BEADS,0.4077,6
20886,90149,SILVER FLOWR PINK SHELL NECKLACE,0.4077,7
20886,72803A,ROSE SCENT CANDLE JEWELLED DRAWER,0.4011,8
20886,22070,SMALL RETRO SPOT MUG IN BOX  RED,0.3927,9
20886,22071,SMALL RETRO SPOT MUG IN BOX  WHITE,0.3898,10
20887,35821P,"JEWELLED DECORATION,PINK",0.8018,1
20887,84572,6 HOOK JEWEL STAND LILAC DRESS,0.7559,2
20887,90011A,MIDNIGHT BLUE CRYSTAL DROP EARRINGS,0.5345,3
20887,20620,RED SPOTTY PASSPORT COVER,0.378,4
20887,20721,OWLS CHARLOTTE BAG,0.378,5
20887,35945,GOLD CHRISTMAS STOCKING DECORATION,0.378,6
20887,84311,CAMOFLAGE CUSHION COVER,0.378,7
20887,85043,RED HEART CANDY POP LIGHTS,0.378,8
20887,85171,S/2 HYACINTH BULB CANDLES,0.378,9
20887,84030C,KNITTED RAINBOW HOT WATER BOTTLE,0.3565,10
20888,17011C,ORIGAMI LAVENDER INCENSE+FLOWER,0.9802,1
20888,17011E,ORIGAMI OPIUM SCENT INCENSE+FLOWER,0.9802,2
20888,22864,MUG AND COASTER SET RED CIRCLES,0.9802,3
20888,35822B,"ACRYLIC BEAD CHAIN, BLUE",0.9802,4
20888,35822P,"ACRYLIC BEAD CHAIN, PINK",0.9802,5
20888,79308B,MOSAIC CANDLE DISH BLUE PURPLE,0.9802,6
20888,84857B,BLUE MONTE CARLO HANDBAG,0.9802,7
20888,84908B,BLUE 5 PATCH FLOWER CUSHION COVER,0.9802,8
20888,84908A,PINK 5 PATCH FLOWER CUSHION COVER,0.9802,9
20888,35817B,"ACRYLIC JEWEL SNOWFLAKE,BLUE",0.9802,10
20889,20993,JAZZ HEARTS MEMO PAD,0.9597,1
20889,37379B,BLUE CHERRY BLOSSOM CUP & SAUCER,0.9585,2
20889,37352,BIRD IN TREE MUG,0.9585,3
20889,37351,ORANGE FLOWER MUG,0.9585,4
20889,20800,LARGE GLASS SUNDAE DISH CLEAR,0.9585,5
20889,47503E,ASS FLORAL PRINT SCISSORS,0.9585,6
20889,16044,POP-ART FLUORESCENT PENS,0.9585,7
20889,20776,ABSTRACT CIRCLES NOTEBOOK,0.9585,8
20889,20775,DAISY NOTEBOOK,0.9585,9
20889,20774,GREEN FERN NOTEBOOK,0.9584,10
20890,20891,LARGE GLASS ROSE SCENTED CANDLE,1.0,1
20890,90164A,PINK ROSEBUD PEARL BRACELET,0.636,2
20890,78034B,BLUE NETTING STORAGE HANGER,0.5145,3
20890,90164B,WHITE  ROSEBUD PEARL BRACELET,0.4835,4
20890,35964,FOLKART CLIP ON STARS,0.4523,5
20890,20835,FRENCH LATTICE CUSHION COVER,0.417,6
20890,84876B,GREEN HEART COMPACT MIRROR,0.2855,7
20890,20837,FRENCH FLORAL CUSHION COVER,0.285,8
20890,35648,VINTAGE BEAD PINK PURSE,0.2814,9
20890,84799,SPRIG LAVENDER ARTIFICIAL FLOWER,0.2743,10
20891,20890,SMALL GLASS ROSE SCENTED CANDLE,1.0,1
20891,90164A,PINK ROSEBUD PEARL BRACELET,0.636,2
20891,78034B,BLUE NETTING STORAGE HANGER,0.5145,3
20891,90164B,WHITE  ROSEBUD PEARL BRACELET,0.4835,4
20891,35964,FOLKART CLIP ON STARS,0.4523,5
20891,20835,FRENCH LATTICE CUSHION COVER,0.417,6
20891,84876B,GREEN HEART COMPACT MIRROR,0.2855,7
20891,20837,FRENCH FLORAL CUSHION COVER,0.285,8
20891,35648,VINTAGE BEAD PINK PURSE,0.2814,9
20891,84799,SPRIG LAVENDER ARTIFICIAL FLOWER,0.2743,10
20892,72598,SET/12 TAPER CANDLES,0.6263,1
20892,40002,WHITE BAMBOO RIBS LAMPSHADE,0.6181,2
20892,17129C,SKY BLUE COLOUR GLASS GEMS IN BAG,0.6158,3
20892,84464,S/60 PINK FLUFFY CHICKS IN BOX,0.612,4
20892,79329,PINK FLOCK GLASS CANDLEHOLDER,0.6097,5
20892,17129F,DEEP BLUE GLASS GEMS IN BAG,0.6093,6
20892,21321,GLASS CHALICE BLUE  LARGE,0.6028,7
20892,20798,CLEAR MILKSHAKE GLASS,0.595,8
20892,47351B,BLUE  VOILE LAMPSHADE,0.5944,9
20892,37485,ENGLISH ROSE TEA SET IN GIFT BOX,0.5904,10
20893,21743,STAR PORTABLE TABLE LIGHT,0.868,1
20893,84255B,ORANGE COCKTAIL GLASS LAMP,0.7935,2
20893,85179B,WHITE BITTY LIGHT CHAIN,0.5949,3
20893,85116,BLACK CANDELABRA T-LIGHT HOLDER,0.5794,4
20893,22179,SET 10 LIGHTS NIGHT OWL,0.5402,5
20893,20886,BOX OF 9 PEBBLE CANDLES,0.5116,6
20893,85180A,RED HEARTS LIGHT CHAIN,0.4163,7
20893,85175,CACTI T-LIGHT CANDLES,0.4096,8
20893,78027,SEAGRASS S/2 CORNER LAUNDRY,0.3796,9
20893,79302M,"ART LIGHTS,FUNK MONKEY",0.3462,10
20894,17129F,DEEP BLUE GLASS GEMS IN BAG,0.7101,1
20894,17129C,SKY BLUE COLOUR GLASS GEMS IN BAG,0.6889,2
20894,40001,WHITE BAMBOO RIBS LAMPSHADE,0.6883,3
20894,84509C,DOTTY PLACEMATS,0.6858,4
20894,40002,WHITE BAMBOO RIBS LAMPSHADE,0.6849,5
20894,84464,S/60 PINK FLUFFY CHICKS IN BOX,0.6796,6
20894,79329,PINK FLOCK GLASS CANDLEHOLDER,0.6756,7
20894,47422,ASSORTED MONKEY SUCTION CUP HOOK,0.6729,8
20894,21321,GLASS CHALICE BLUE  LARGE,0.6679,9
20894,47421,ASSORTED COLOUR LIZARD SUCTION HOOK,0.6669,10
20895,20618,QUEEN OF THE SKIES PASSPORT COVER,0.5056,1
20895,17191A,ROSE FLOWER CANDLE+INCENSE 16X16CM,0.466,2
20895,79329,PINK FLOCK GLASS CANDLEHOLDER,0.2429,3
20895,40002,WHITE BAMBOO RIBS LAMPSHADE,0.2417,4
20895,17129C,SKY BLUE COLOUR GLASS GEMS IN BAG,0.2408,5
20895,84464,S/60 PINK FLUFFY CHICKS IN BOX,0.2394,6
20895,17129F,DEEP BLUE GLASS GEMS IN BAG,0.2383,7
20895,21321,GLASS CHALICE BLUE  LARGE,0.2358,8
20895,47351B,BLUE  VOILE LAMPSHADE,0.2324,9
20895,37485,ENGLISH ROSE TEA SET IN GIFT BOX,0.2309,10
20896,20899,VINTAGE NOTEBOOK RED ROSE,0.8136,1
20896,84791,GINGHAM HEART DECORATION,0.4484,2
20896,90001D,ANTIQUE OLIVE GREEN FLOWER EARRINGS,0.394,3
20896,84578,ELEPHANT TOY WITH BLUE T-SHIRT,0.3849,4
20896,47597,NEW ENGLAND TEATOWELS,0.3607,5
20896,81950V,FLOWER PURPLE CLOCK W/SUCKER,0.3187,6
20896,20906,VINTAGE NOTEBOOK BEAUTY GIRL,0.3161,7
20896,84629,WHITE 3 FRAME BIRDS AND TREE,0.3052,8
20896,84581,DOG TOY WITH PINK CROCHET SKIRT,0.2989,9
20896,17107D,"FLOWER FAIRY,5 SUMMER B'DRAW LINERS",0.2812,10
20897,84908A,PINK 5 PATCH FLOWER CUSHION COVER,0.9281,1
20897,17011C,ORIGAMI LAVENDER INCENSE+FLOWER,0.928,2
20897,17011E,ORIGAMI OPIUM SCENT INCENSE+FLOWER,0.928,3
20897,22864,MUG AND COASTER SET RED CIRCLES,0.928,4
20897,35822B,"ACRYLIC BEAD CHAIN, BLUE",0.928,5
20897,35822P,"ACRYLIC BEAD CHAIN, PINK",0.928,6
20897,79308B,MOSAIC CANDLE DISH BLUE PURPLE,0.928,7
20897,84857B,BLUE MONTE CARLO HANDBAG,0.928,8
20897,84908B,BLUE 5 PATCH FLOWER CUSHION COVER,0.928,9
20897,35817B,"ACRYLIC JEWEL SNOWFLAKE,BLUE",0.928,10
20898,17011C,ORIGAMI LAVENDER INCENSE+FLOWER,0.9663,1
20898,17011E,ORIGAMI OPIUM SCENT INCENSE+FLOWER,0.9663,2
20898,22864,MUG AND COASTER SET RED CIRCLES,0.9663,3
20898,35822B,"ACRYLIC BEAD CHAIN, BLUE",0.9663,4
20898,35822P,"ACRYLIC BEAD CHAIN, PINK",0.9663,5
20898,79308B,MOSAIC CANDLE DISH BLUE PURPLE,0.9663,6
20898,84857B,BLUE MONTE CARLO HANDBAG,0.9663,7
20898,84908A,PINK 5 PATCH FLOWER CUSHION COVER,0.9663,8
20898,84908B,BLUE 5 PATCH FLOWER CUSHION COVER,0.9663,9
20898,35817B,"ACRYLIC JEWEL SNOWFLAKE,BLUE",0.9662,10
20899,20896,VINTAGE NOTEBOOK PINK FLOWER,0.8136,1
20899,90001D,ANTIQUE OLIVE GREEN FLOWER EARRINGS,0.5361,2
20899,81950V,FLOWER PURPLE CLOCK W/SUCKER,0.53,3
20899,90000D,COPPER/OLIVE GREEN FLOWER NECKLACE,0.4676,4
20899,47597,NEW ENGLAND TEATOWELS,0.438,5
20899,40046C,PINK BUTTERFLY PAPER LAMPSHADE,0.4107,6
20899,17107D,"FLOWER FAIRY,5 SUMMER B'DRAW LINERS",0.3768,7
20899,20906,VINTAGE NOTEBOOK BEAUTY GIRL,0.368,8
20899,84629,WHITE 3 FRAME BIRDS AND TREE,0.3626,9
20899,84791,GINGHAM HEART DECORATION,0.3565,10
20901,20678,LARGE BLACK DIAMANTE HAIRSLIDE,0.562,1
20901,90076,MONTANA DIAMOND CLUSTER EARRINGS,0.562,2
20901,90141D,ROSE PENDANT TRIPLE SHELL NECKLACE,0.562,3
20901,90177A,CLASSIC DIAMANTE EARRINGS JET,0.5543,4
20901,84867A,PINK BABY GIRLS PHOTO ALBUM,0.5524,5
20901,90118,PINK DAISY BAG CHARM,0.547,6
20901,90177E,DROP DIAMANTE EARRINGS GREEN,0.547,7
20901,90202A,PURPLE ENAMEL FLOWER HAIR TIE,0.547,8
20901,90101,WHITE FRANGIPANI NECKLACE,0.5452,9
20901,35912B,WHITE/PINK CHICK DECORATION,0.5402,10
20902,72800A,S/4 BLACK DINNER CANDLE SILVER FLOC,0.6892,1
20902,84908A,PINK 5 PATCH FLOWER CUSHION COVER,0.6872,2
20902,17011C,ORIGAMI LAVENDER INCENSE+FLOWER,0.6868,3
20902,17011E,ORIGAMI OPIUM SCENT INCENSE+FLOWER,0.6868,4
20902,22864,MUG AND COASTER SET RED CIRCLES,0.6868,5
20902,35822B,"ACRYLIC BEAD CHAIN, BLUE",0.6868,6
20902,35822P,"ACRYLIC BEAD CHAIN, PINK",0.6868,7
20902,79308B,MOSAIC CANDLE DISH BLUE PURPLE,0.6868,8
20902,84857B,BLUE MONTE CARLO HANDBAG,0.6868,9
20902,84908B,BLUE 5 PATCH FLOWER CUSHION COVER,0.6868,10
20903,72811,SMALL ZINC/GLASS CANDLEHOLDER,0.6623,1
20903,20898,VINTAGE NOTEBOOK TRAVELOGUE,0.6374,2
20903,21847,GREEN  DIAMANTE PEN IN GIFT BOX,0.6312,3
20903,84402D,PINK DRESS JEWELLERY STAND,0.6249,4
20903,21846,PINK DIAMANTE PEN IN GIFT BOX,0.617,5
20903,84405A,S/3 PINK COL METAL BASKET W HANDLE,0.6139,6
20903,72772,SET/4 SCENTED CANDLES IN RAMEKINS,0.609,7
20903,84684,BEACH HUT PHOTO FRAME,0.6045,8
20903,84858B,BLUE RIVIERA HANDBAG,0.6019,9
20903,85166B,BLACK METAL BAROQUE PHOTO FRAME,0.6003,10
20905,20620,RED SPOTTY PASSPORT COVER,0.2357,1
20905,20721,OWLS CHARLOTTE BAG,0.2357,2
20905,35945,GOLD CHRISTMAS STOCKING DECORATION,0.2357,3
20905,84311,CAMOFLAGE CUSHION COVER,0.2357,4
20905,85043,RED HEART CANDY POP LIGHTS,0.2357,5
20905,85171,S/2 HYACINTH BULB CANDLES,0.2357,6
20905,84030C,KNITTED RAINBOW HOT WATER BOTTLE,0.2223,7
20905,85095,THREE CANVAS LUGGAGE TAGS,0.2021,8
20905,84030B,KNITTED POM POM HOT WATER BOTTLE,0.1961,9
20905,82607C,GLASS BONBON JAR. SUPERFINES,0.1956,10
20906,90001D,ANTIQUE OLIVE GREEN FLOWER EARRINGS,0.4358,1
20906,47597,NEW ENGLAND TEATOWELS,0.4291,2
20906,20899,VINTAGE NOTEBOOK RED ROSE,0.368,3
20906,81950V,FLOWER PURPLE CLOCK W/SUCKER,0.3447,4
20906,84629,WHITE 3 FRAME BIRDS AND TREE,0.3419,5
20906,23315,IVORY REFECTORY CLOCK,0.324,6
20906,20678,LARGE BLACK DIAMANTE HAIRSLIDE,0.3203,7
20906,90076,MONTANA DIAMOND CLUSTER EARRINGS,0.3203,8
20906,90141D,ROSE PENDANT TRIPLE SHELL NECKLACE,0.3203,9
20906,84499,BLACK FLOWER CANDLE PLATE,0.3166,10
20910,20620,RED SPOTTY PASSPORT COVER,0.8055,1
20910,20721,OWLS CHARLOTTE BAG,0.8055,2
20910,35945,GOLD CHRISTMAS STOCKING DECORATION,0.8055,3
20910,84311,CAMOFLAGE CUSHION COVER,0.8055,4
20910,85043,RED HEART CANDY POP LIGHTS,0.8055,5
20910,85171,S/2 HYACINTH BULB CANDLES,0.8055,6
20910,84030C,KNITTED RAINBOW HOT WATER BOTTLE,0.7597,7
20910,85095,THREE CANVAS LUGGAGE TAGS,0.6905,8
20910,84030B,KNITTED POM POM HOT WATER BOTTLE,0.6702,9
20910,21927,BLUE/CREAM STRIPE CUSHION COVER,0.6657,10
20913,20715,LITTLE FLOWER SHOPPER BAG,0.9954,1
20913,37345,ASSTD HEARTS DESIGN MUGS,0.9954,2
20913,84798A,PINK FOXGLOVE ARTIIFCIAL FLOWER,0.9883,3
20913,23046,PAPER LANTERN 9 POINT DELUXE STAR,0.9878,4
20913,21438,TUB 24 HANGING EASTER EGGS SPOTTY,0.9815,5
20913,22936,BAKING MOULD ROSE WHITE CHOCOLATE,0.9767,6
20913,21477,STRING OF 20 ROSE LIGHTS,0.9756,7
20913,23040,PAPER LANTERN 9 POINT SNOW STAR,0.9717,8
20913,84849D,HOT BATHS SOAP HOLDER,0.9653,9
20913,21593,SWALLOW CIGAR BOX MATCHES,0.9601,10
20914,21169,YOU'RE CONFUSING ME METAL SIGN,0.7983,1
20914,22199,FRYING PAN RED POLKADOT,0.7936,2
20914,20754,RETRO RED SPOTTY WASHING UP GLOVES,0.7928,3
20914,20715,LITTLE FLOWER SHOPPER BAG,0.7875,4
20914,20913,SET/5 BLUE SPOTTY LID GLASS BOWLS,0.7864,5
20914,37345,ASSTD HEARTS DESIGN MUGS,0.7856,6
20914,23046,PAPER LANTERN 9 POINT DELUXE STAR,0.7825,7
20914,84798A,PINK FOXGLOVE ARTIIFCIAL FLOWER,0.7822,8
20914,22838,3 TIER CAKE TIN RED AND CREAM,0.7781,9
20914,21438,TUB 24 HANGING EASTER EGGS SPOTTY,0.778,10
20931,20932,PINK POT PLANT CANDLE,0.5635,1
20931,23480,MINI LIGHTS WOODLAND MUSHROOMS,0.469,2
20931,22592,CARDHOLDER HOLLY WREATH METAL,0.4578,3
20931,22505,MEMO BOARD COTTAGE DESIGN,0.4484,4
20931,21561,DINOSAUR LUNCHBOX WITH CUTLERY,0.4478,5
20931,21559,STRAWBERRY LUNCHBOX WITH CUTLERY,0.4436,6
20931,23126,DOLLCRAFT GIRL AMELIE KIT,0.4424,7
20931,35915A,CREAM KNITTED HEN,0.4424,8
20931,35961,FOLKART ZINC HEART CHRISTMAS DEC,0.4417,9
20931,35915C,PEACH KNITTED HEN,0.4409,10
20932,20931,BLUE POT PLANT CANDLE,0.5635,1
20932,23073,GEORGIAN TRINKET BOX,0.5208,2
20932,21628,TRIANGULAR POUFFE VINTAGE,0.4826,3
20932,82011C,BATHROOM SCALES FOOTPRINTS IN SAND,0.449,4
20932,84609,TALL ROCOCO CANDLE HOLDER,0.4481,5
20932,85168B,BLACK BAROQUE CARRIAGE CLOCK,0.4324,6
20932,23397,FOOT STOOL HOME SWEET HOME,0.4299,7
20932,23407,SET OF 2 TRAYS HOME SWEET HOME,0.4111,8
20932,21813,GARLAND WITH STARS AND BELLS,0.4064,9
20932,72807B,SET/3 OCEAN SCENT CANDLE JEWEL BOX,0.3794,10
20933,15059A,ENGLISH ROSE EDWARDIAN PARASOL,0.9884,1
20933,22790,"MIRROR, ARCHED GEORGIAN",0.9884,2
20933,48175,DOOR MAT CAMOUFLAGE,0.9884,3
20933,85128,PLANTPOT SINGLE HOOK PISTACHIO,0.9884,4
20933,37482B,CUBIC MUG BLUE POLKA DOT,0.9884,5
20933,21308,LOUVRE VANITY MIRROR,0.9883,6
20933,84767,ZINC POLICE BOX LANTERN,0.9882,7
20933,22830,UTILTY CABINET WITH HOOKS,0.9882,8
20933,23134,LARGE ZINC HEART WALL ORGANISER,0.9882,9
20933,23135,SMALL ZINC HEART WALL ORGANISER,0.988,10
20934,21107,CREAM SLICE FLANNEL PINK SPOT,0.7196,1
20934,72023F,RED ORGANIC CANDLE IN GLASS,0.7162,2
20934,22095,LADS ONLY TISSUE BOX,0.702,3
20934,85038,6 CHOCOLATE LOVE HEART T-LIGHTS,0.6952,4
20934,84029E,RED WOOLLY HOTTIE WHITE HEART.,0.6926,5
20934,82615,PINK MARSHMALLOW SCARF KNITTING KIT,0.692,6
20934,21864,UNION JACK FLAG PASSPORT COVER,0.6877,7
20934,22646,CERAMIC STRAWBERRY CAKE MONEY BANK,0.6391,8
20934,72802A,ROSE SCENT CANDLE IN JEWELLED BOX,0.6134,9
20934,35004C,SET OF 3 COLOURED  FLYING DUCKS,0.6058,10
20935,20936,FORKED CACTUS CANDLE,0.7412,1
20935,72772,SET/4 SCENTED CANDLES IN RAMEKINS,0.6402,2
20935,21317,GLASS SPHERE CANDLE STAND MEDIUM,0.6182,3
20935,46776A,WOVEN BUBBLE GUM CUSHION COVER,0.6148,4
20935,46776B,WOVEN BERRIES CUSHION COVER,0.614,5
20935,35824B,"HANGING FLOWERS+MIRROR,BLUE",0.6123,6
20935,20888,SET 3 JARDIN DE FEMME SCENT CANDLES,0.6118,7
20935,35821B,"JEWELLED DECORATION,BLUE",0.6117,8
20935,84933C,LARGE BLUE ORIENTAL FOLDING STOOL,0.6101,9
20935,72800A,S/4 BLACK DINNER CANDLE SILVER FLOC,0.604,10
20936,20935,ROUND CACTUS CANDLE,0.7412,1
20936,72772,SET/4 SCENTED CANDLES IN RAMEKINS,0.6766,2
20936,20888,SET 3 JARDIN DE FEMME SCENT CANDLES,0.6555,3
20936,35824B,"HANGING FLOWERS+MIRROR,BLUE",0.6471,4
20936,35821B,"JEWELLED DECORATION,BLUE",0.6465,5
20936,84933C,LARGE BLUE ORIENTAL FOLDING STOOL,0.6454,6
20936,72800A,S/4 BLACK DINNER CANDLE SILVER FLOC,0.6376,7
20936,44235,ASS COL CIRCLE MOBILE,0.6328,8
20936,84869,CANDY BUTTON PHOTO ALBUM,0.6323,9
20936,35824P,"HANGING FLOWERS+MIRROR,PINK",0.6299,10
20939,72785A,S/4 CONTEMPORY PINK ROSEBUD CANDLES,0.7071,1
20939,72785B,S/4 CONTEMPORY RED ROSEBUD CANDLES,0.5071,2
20939,90139,FLOWER BROOCH 4 ASSORTED COLOURS,0.3333,3
20939,72771C,BLACK FLOCK GOLD CANDLE,0.2115,4
20939,90206A,GOLD DIAMANTE STAR BROOCH,0.2041,5
20939,72801F,S/4 FESTIVE RED DINNER CANDLES,0.1945,6
20939,46000S,POLYESTER FILLER PAD 40X40CM,0.1733,7
20939,85026B,EAU DE NILE JEWELLED T-LIGHT HOLDER,0.1722,8
20939,84882,GREEN WIRE STANDING CANDLE HOLDER,0.1495,9
20939,21341,KASBAH LANTERN WITH GLASS,0.117,10
20940,23376,PACK OF 12 VINTAGE CHRISTMAS TISSUE,0.7969,1
20940,23378,PACK OF 12 50'S CHRISTMAS TISSUES,0.5905,2
20940,23267,SET OF 4 SANTA PLACE SETTINGS,0.4881,3
20940,84971S,SMALL HEART FLOWERS HOOK,0.4715,4
20940,23271,CHRISTMAS TABLE CANDLE SILVER SPIKE,0.4586,5
20940,20981,12 PENCILS TALL TUBE WOODLAND,0.3838,6
20940,23597,PAPER BUNTING PAISLEY PARK,0.3771,7
20940,21587,COSY HOUR GIANT TUBE MATCHES,0.3646,8
20940,21186,WHITE DOVE HONEYCOMB PAPER GARLAND,0.3562,9
20940,79067,CORONA MEXICAN TRAY,0.3486,10
20941,23598,PAPER BUNTING VINTAGE PARTY,0.7243,1
20941,21946,PARTY TIME DESIGN FLANNEL,0.7204,2
20941,21344,MOROCCAN BEATEN METAL DISH,0.7155,3
20941,22100,SKULLS SQUARE TISSUE BOX,0.7124,4
20941,35971,ROSE FOLKART HEART DECORATIONS,0.7124,5
20941,20707,CRAZY DAISY HEART DECORATION,0.7088,6
20941,84459A,PINK METAL CHICKEN HEART,0.6861,7
20941,21331,MOROCCAN BEATEN METAL DISH LARGE,0.6758,8
20941,22471,TV DINNER TRAY AIR HOSTESS,0.6725,9
20941,22378,WALL TIDY RETROSPOT,0.6588,10
20942,20881,MODERN CHRISTMAS TREE CANDLE,0.6325,1
20942,85083,KISS REINDEER SCANDINAVIAN STOCKING,0.5262,2
20942,84247H,PACK/12 DECOUPAGE CARD,0.5169,3
20942,20884,MODERN CHRISTMAS TREE CANDLE,0.4472,4
20942,35838B,S/6 SILVER ORNAMENETAL CANDLE,0.3772,5
20942,20885,BOX OF 3 PEBBLE CANDLES,0.3162,6
20942,35995,SET/6 BLACK GLITTER REINDEER CANDLE,0.3162,7
20942,10138,ASSORTED COLOUR JUMBO PEN,0.2844,8
20942,20877,MODERN CHRISTMAS BAUBLE CANDLE,0.2798,9
20942,84251J,"GREETING CARD, THE BLACK CAT",0.239,10
20943,35991,SET/6 BLACK SNOWFLAKE T-LIGHTS,0.2658,1
20943,84006,MAGIC TREE -PAPER FLOWERS,0.2295,2
20943,84250M,"GREETING CARD, BLACKPOOL ROCK",0.2016,3
20943,22431,WATERING CAN BLUE ELEPHANT,0.1805,4
20943,84247K,"FOLK ART GREETING CARD,PACK/12",0.1712,5
20943,21724,PANDA AND BUNNIES STICKER SHEET,0.1688,6
20943,22433,WATERING CAN GREEN DINOSAUR,0.1568,7
20943,23477,WOODLAND LARGE BLUE FELT HEART,0.1523,8
20943,37495,FAIRY CAKE BIRTHDAY CANDLE SET,0.1507,9
20943,20987,GEISHA GIRL CHOPSTICKS SET/5,0.1473,10
20950,21698,MOCK LOBSTER FRIDGE MAGNET,0.3574,1
20950,84255B,ORANGE COCKTAIL GLASS LAMP,0.3484,2
20950,84723,CHERRY BLOSSOM CANVAS ART PICTURE,0.3365,3
20950,71510,SQUARE METAL CANDLEHOLDER BASE,0.3242,4
20950,18094C,WHITE/BLUE RECT CERAMIC OIL BURNER,0.3226,5
20950,85230G,ORANGE VOTIVE CANDLE,0.3096,6
20950,72134,COLUMBIAN  CUBE CANDLE,0.3066,7
20950,85231G,ORANGE SCENTED SET/9 T-LIGHTS,0.306,8
20950,79144C,PAINTED LIGHTBULB RAINBOW DESIGN,0.3051,9
20950,75178,ASSTD COL BUTTERFLY/CRYSTAL W/CHIME,0.3008,10
20952,23568,EGG CUP HENRIETTA HEN CREAM,0.9533,1
20952,23566,EGG CUP MILKMAID HEIDI,0.9484,2
20952,21844,RETRO SPOT MUG,0.9409,3
20952,21531,RETRO SPOT SUGAR JAM BOWL,0.9371,4
20952,22361,GLASS JAR DAISY FRESH COTTON WOOL,0.936,5
20952,22713,CARD I LOVE LONDON,0.9302,6
20952,20828,GLITTER BUTTERFLY CLIPS,0.9223,7
20952,23437,50'S CHRISTMAS GIFT BAG LARGE,0.9183,8
20952,21535,RETRO SPOT SMALL MILK JUG,0.9158,9
20952,22652,TRAVEL SEWING KIT,0.9139,10
20953,37326,FAIRY DESIGN MUGS,0.504,1
20953,35823P,"ACRYLIC BEAD GARLAND,PINK",0.3563,2
20953,37477B,"FLOWER FAIRY MUG+COASTER,LAVENDER",0.2097,3
20953,82011A,"BATHROOM SCALES, TROPICAL BEACH",0.1701,4
20953,37477C,"FLOWER FAIRY MUG+COASTER,ROSE",0.126,5
20953,84613C,BLUE NEW BAROQUE FLOCK CANDLESTICK,0.1214,6
20953,10124G,ARMY CAMO BOOKCOVER TAPE,0.1061,7
20953,84559D,3D SHEET OF SEA WORLD STICKERS,0.0995,8
20953,90127B,BLUE BEADS+HAND PHONE CHARM,0.0891,9
20953,10124A,SPOTS ON RED BOOKCOVER TAPE,0.0873,10
20956,20846,ZINC HEART LATTICE T-LIGHT HOLDER,0.272,1
20956,21352,EUCALYPTUS & PINECONE  WREATH,0.2592,2
20956,72803A,ROSE SCENT CANDLE JEWELLED DRAWER,0.2587,3
20956,90154,LAZER CUT NECKLACE W PASTEL BEADS,0.2563,4
20956,35930,PINK HEART CHRISTMAS DECORATION,0.2517,5
20956,35974,S/6 CHRISTMAS TREE PLACE SETTING,0.2517,6
20956,90149,SILVER FLOWR PINK SHELL NECKLACE,0.2508,7
20956,22071,SMALL RETRO SPOT MUG IN BOX  WHITE,0.2437,8
20956,22070,SMALL RETRO SPOT MUG IN BOX  RED,0.2428,9
20956,22119,PEACE WOODEN BLOCK LETTERS,0.239,10
20957,20958,PORCELAIN HANGING BELL LARGE,0.608,1
20957,21820,GLITTER HEART GARLAND WITH BELLS,0.4732,2
20957,21821,GLITTER STAR GARLAND WITH BELLS,0.3376,3
20957,22501,PICNIC BASKET WICKER LARGE,0.3056,4
20957,21804,WHITE CHRISTMAS GARLAND STARS TREES,0.2795,5
20957,85048,15CM CHRISTMAS GLASS BALL 20 LIGHTS,0.2467,6
20957,15058B,PINK WHITE SPOTS GARDEN PARASOL,0.2422,7
20957,21324,HANGING MEDINA LANTERN SMALL,0.2272,8
20957,47591A,CAROUSEL DES CHILD'S APRON,0.194,9
20957,84837,WHITE SWEETHEARTS CABINET 4 DRAWERS,0.1797,10
20958,20957,PORCELAIN HANGING BELL SMALL,0.608,1
20958,21820,GLITTER HEART GARLAND WITH BELLS,0.5068,2
20958,21821,GLITTER STAR GARLAND WITH BELLS,0.3691,3
20958,22501,PICNIC BASKET WICKER LARGE,0.3425,4
20958,21804,WHITE CHRISTMAS GARLAND STARS TREES,0.2997,5
20958,85083,KISS REINDEER SCANDINAVIAN STOCKING,0.2785,6
20958,85048,15CM CHRISTMAS GLASS BALL 20 LIGHTS,0.2676,7
20958,15058B,PINK WHITE SPOTS GARDEN PARASOL,0.2641,8
20958,21324,HANGING MEDINA LANTERN SMALL,0.253,9
20958,84837,WHITE SWEETHEARTS CABINET 4 DRAWERS,0.2034,10
20960,20963,APPLE BATH SPONGE,0.7757,1
20960,20961,STRAWBERRY BATH SPONGE,0.7688,2
20960,21131,GOLD STANDING GNOME,0.6753,3
20960,84952B,BLACK LOVE BIRD T-LIGHT HOLDER,0.6699,4
20960,84952C,MIRROR LOVE BIRD T-LIGHT HOLDER,0.6689,5
20960,37461,FUNKY MONKEY MUG,0.6659,6
20960,23382,BOX OF 6 CHRISTMAS CAKE DECORATIONS,0.6634,7
20960,85040B,SET/4 BLUE FLOWER CANDLES IN BOWL,0.6622,8
20960,20814,SILVER FINCH DECORATION,0.6577,9
20960,23509,MINI PLAYING CARDS FUN FAIR,0.6577,10
20961,20963,APPLE BATH SPONGE,0.9757,1
20961,21131,GOLD STANDING GNOME,0.9345,2
20961,84952B,BLACK LOVE BIRD T-LIGHT HOLDER,0.9314,3
20961,84952C,MIRROR LOVE BIRD T-LIGHT HOLDER,0.9292,4
20961,37461,FUNKY MONKEY MUG,0.9261,5
20961,85040B,SET/4 BLUE FLOWER CANDLES IN BOWL,0.926,6
20961,20814,SILVER FINCH DECORATION,0.9218,7
20961,20825,GOLD WINE GLASS,0.9204,8
20961,23509,MINI PLAYING CARDS FUN FAIR,0.9155,9
20961,21499,BLUE SPOTS  WRAP,0.9139,10
20963,20961,STRAWBERRY BATH SPONGE,0.9757,1
20963,84952B,BLACK LOVE BIRD T-LIGHT HOLDER,0.9175,2
20963,84952C,MIRROR LOVE BIRD T-LIGHT HOLDER,0.9153,3
20963,37461,FUNKY MONKEY MUG,0.9123,4
20963,85040B,SET/4 BLUE FLOWER CANDLES IN BOWL,0.9118,5
20963,21131,GOLD STANDING GNOME,0.911,6
20963,20814,SILVER FINCH DECORATION,0.9077,7
20963,20825,GOLD WINE GLASS,0.9064,8
20963,23509,MINI PLAYING CARDS FUN FAIR,0.9017,9
20963,16237,SLEEPING CAT ERASERS,0.9008,10
20964,84705D,CHERRY BLOSSOM PHOTO FRAME,0.5595,1
20964,44265,M/COLOUR POM-POM CURTAIN,0.4472,2
20964,20702,PINK PADDED MOBILE,0.399,3
20964,84199,GLOW IN DARK DOLPHINS,0.2741,4
20964,23054,RECYCLED ACAPULCO MAT LAVENDER,0.274,5
20964,84948,SILVER HANGING T-LIGHT HOLDER DOME,0.252,6
20964,23053,RECYCLED ACAPULCO MAT PINK,0.2504,7
20964,23050,RECYCLED ACAPULCO MAT GREEN,0.2302,8
20964,20703,BLUE PADDED SOFT MOBILE,0.2223,9
20964,20620,RED SPOTTY PASSPORT COVER,0.2108,10
20966,79190D,RETRO PLASTIC DAISY TRAY,0.93,1
20966,79190A,RETRO PLASTIC 70'S TRAY,0.901,2
20966,35597A,DUSTY PINK CHRISTMAS TREE 30CM,0.8575,3
20966,79320,FLAMINGO LIGHTS,0.7817,4
20966,20671,BLUE TEATIME PRINT BOWL,0.7794,5
20966,20753,RETRO PINK SPOT WASHING UP GLOVES,0.768,6
20966,90130C,GREEN STONE/CRYSTAL EARRINGS,0.6779,7
20966,47480,HANGING PHOTO CLIP ROPE LADDER,0.6256,8
20966,20960,WATERMELON BATH SPONGE,0.6216,9
20966,84596B,SMALL DOLLY MIX DESIGN ORANGE BOWL,0.4823,10
20967,84546,CROCHET POODLE KEYRING,0.4425,1
20967,85185D,FROG SOCK PUPPET,0.4299,2
20967,21420,OYSTER TRINKET BOX,0.3962,3
20967,85185B,PINK HORSE SOCK PUPPET,0.3947,4
20967,20968,GREEN FLORAL FELTCRAFT SHOULDER BAG,0.3752,5
20967,20970,PINK FLORAL FELTCRAFT SHOULDER BAG,0.3623,6
20967,22307,GOLD MUG BONE CHINA TREE OF LIFE,0.3088,7
20967,21726,MULTI HEARTS  STICKERS,0.3035,8
20967,21719,LOVELY BONBON STICKER SHEET,0.2995,9
20967,21553,CERAMIC BIRDHOUSE FINCH BLUE  LARGE,0.2976,10
20968,21724,PANDA AND BUNNIES STICKER SHEET,0.4378,1
20968,78056,CAMOUFLAGE BACKPACK ON WHEELS,0.4303,2
20968,20967,GREY FLORAL FELTCRAFT SHOULDER BAG,0.3752,3
20968,21726,MULTI HEARTS  STICKERS,0.3598,4
20968,85185E,DUCK SOCK PUPPET,0.3266,5
20968,85185B,PINK HORSE SOCK PUPPET,0.3226,6
20968,84247L,FAWN AND MUSHROOM GREETING CARD,0.3185,7
20968,22431,WATERING CAN BLUE ELEPHANT,0.2985,8
20968,21721,CANDY SHOP  STICKER SHEET,0.2908,9
20968,85185F,LION SOCK PUPPET,0.2902,10
20969,22273,FELTCRAFT DOLL MOLLY,0.9279,1
20969,22779,WOODEN OWLS LIGHT GARLAND,0.9039,2
20969,22780,LIGHT GARLAND BUTTERFILES PINK,0.9037,3
20969,84880,WHITE WIRE EGG HOLDER,0.8809,4
20969,21465,PINK FLOWER CROCHET FOOD COVER,0.8712,5
20969,72756,FAIRY CAKE CANDLES,0.8642,6
20969,21468,BUTTERFLY CROCHET FOOD COVER,0.8612,7
20969,22174,PHOTO CUBE,0.8598,8
20969,22063,CERAMIC BOWL WITH STRAWBERRY DESIGN,0.8505,9
20969,22147,FELTCRAFT BUTTERFLY HEARTS,0.8482,10
20970,21649,ASSORTED TUTTI FRUTTI PHOTO FRAME,0.5974,1
20970,21366,MIRRORED WALL ART PHOTO FRAMES,0.5961,2
20970,20786,BLACK RETRO BAR STOOL,0.5776,3
20970,21842,PINK HEART CANDY BUTTON CALCULATOR,0.5775,4
20970,84968E,S/16 VINTAGE BLACK CUTLERY,0.5593,5
20970,21832,CHOCOLATE CALCULATOR,0.5084,6
20970,84968D,S/16 VINTAGE RED CUTLERY,0.4679,7
20970,46126A,ELVIS WALLHANGING / CURTAIN,0.4343,8
20970,20785,FUSCHIA RETRO BAR STOOL,0.4218,9
20970,23126,DOLLCRAFT GIRL AMELIE KIT,0.4165,10
20971,22147,FELTCRAFT BUTTERFLY HEARTS,0.913,1
20971,22273,FELTCRAFT DOLL MOLLY,0.8656,2
20971,22779,WOODEN OWLS LIGHT GARLAND,0.8587,3
20971,22780,LIGHT GARLAND BUTTERFILES PINK,0.842,4
20971,20969,RED FLORAL FELTCRAFT SHOULDER BAG,0.8134,5
20971,84880,WHITE WIRE EGG HOLDER,0.7969,6
20971,21465,PINK FLOWER CROCHET FOOD COVER,0.7899,7
20971,72756,FAIRY CAKE CANDLES,0.7844,8
20971,22174,PHOTO CUBE,0.7807,9
