StockCode,recommended_StockCode,recommended_Description,similarity_score,rank
10002,23215,JINGLE BELL HEART ANTIQUE SILVER,0.9053,1
10002,11001,ASSTD DESIGN RACING CAR PEN,0.9028,2
10002,22991,GIRAFFE WOODEN RULER,0.8875,3
10002,20783,HEART EAR MUFF HEADPHONES,0.885,4
10002,22191,EAU DE NIL DINER WALL CLOCK,0.8806,5
10002,22150,3 STRIPEY MICE FELTCRAFT,0.8662,6
10002,84879,ASSORTED COLOUR BIRD ORNAMENT,0.8354,7
10002,21428,SET3 BOOK BOX GREEN GINGHAM FLOWER,0.8301,8
10002,20972,PINK CREAM FELT CRAFT TRINKET BOX,0.8271,9
10002,21481,FAWN BLUE HOT WATER BOTTLE,0.8149,10
10080,84715,SET OF 6 ICE CREAM SKITTLES,0.2383,1
10080,90005A,JADE GREEN ENAMEL HAIR COMB,0.2168,2
10080,35471D,SET OF 3 BIRD LIGHT PINK FEATHER,0.1564,3
10080,16161G,WRAP BAD HAIR DAY,0.1512,4
10080,21194,PINK  HONEYCOMB PAPER FAN,0.1499,5
10080,21195,PINK  HONEYCOMB PAPER BALL,0.146,6
10080,21262,WHITE GOOSE FEATHER CHRISTMAS TREE,0.1276,7
10080,22099,CARAVAN SQUARE TISSUE BOX,0.1256,8
10080,22195,HEART MEASURING SPOONS LARGE,0.1216,9
10080,85025B,EAU DE NILE HEART SHAPE PHOTO FRAME,0.118,10
10109,16215,FUNKY GIRLZ MAGNETIC TO DO LIST,0.7845,1
10109,16245A,PINK MINI STATIONERY SET W CASE,0.6547,2
10109,81953B,ROUND ARTICULATED BLUE CLOCK W/SUCK,0.625,3
10109,81953P,ROUND ARTICULATED PINK CLOCK W/SUCK,0.3671,4
10109,23185,FRENCH STYLE STORAGE JAR JAM,0.3128,5
10109,84455,SET OF 3 RABBIT CARROTS EASTER,0.2659,6
10109,84925C,FAIRY CAKES  WALL THERMOMETER,0.2592,7
10109,84340,LARGE FIBRE OPTIC CHRISTMAS TREE,0.2443,8
10109,20673,STRAWBERRIES PRINT BOWL,0.2425,9
10109,47552A,DOTS IRONING BOARD COVER,0.2425,10
10120,16236,KITTY PENCIL ERASERS,0.2509,1
10120,84206A,3 BLACK CATS W HEARTS BLANK CARD,0.2449,2
10120,84559D,3D SHEET OF SEA WORLD STICKERS,0.2319,3
10120,17061,ASSORTED SHAPED STENCIL FOR HENNA,0.2131,4
10120,85024A,CRYSTAL SMALL JEWELLED PHOTOFRAME,0.2131,5
10120,84371,BIG PINK POODLE,0.2092,6
10120,16248B,BLUE HOLE PUNCH,0.2057,7
10120,46037A,PINK CANVAS DES CUSHION COVER,0.1906,8
10120,72739C,DARK CHOCOLATE SCENTCANDLE,0.1901,9
10120,72739B,WHITE CHOCOLATE SCENT CANDLE,0.1863,10
10123C,21088,SET/6 FRUIT SALAD PAPER CUPS,0.8735,1
10123C,21096,SET/6 FRUIT SALAD  PAPER PLATES,0.873,2
10123C,10123G,ARMY CAMO WRAPPING TAPE,0.8674,3
10123C,20670,VIP HOLIDAY PURSE,0.8668,4
10123C,16043,POP ART PUSH DOWN RUBBER,0.8662,5
10123C,37423,WHITE WITH BLACK CATS PLATE,0.8661,6
10123C,85160A,WHITE BIRD GARDEN DESIGN MUG,0.8658,7
10123C,84493,BLUE/PINK NEST STRIPE BOX,0.8658,8
10123C,37444B,BLUE BREAKFAST CUP AND SAUCER,0.8658,9
10123C,84924F,PSYCHEDELIC METAL SIGN CALENDAR,0.8658,10
10123G,85160A,WHITE BIRD GARDEN DESIGN MUG,0.9999,1
10123G,84493,BLUE/PINK NEST STRIPE BOX,0.9999,2
10123G,37444B,BLUE BREAKFAST CUP AND SAUCER,0.9999,3
10123G,84924F,PSYCHEDELIC METAL SIGN CALENDAR,0.9999,4
10123G,85160B,BLACK BIRD GARDEN DESIGN MUG,0.9999,5
10123G,84924D,LA PALMIERA METAL SIGN CALENDAR,0.9999,6
10123G,21392,RED SPOTTY PUDDING BOWL,0.9999,7
10123G,16047,POP ART PEN CASE & PENS,0.9999,8
10123G,84847,FLORAL BATHROOM SET,0.9999,9
10123G,37471,MULTICOLOUR DOTS PLATE,0.9999,10
10124A,62074B,ELEPHANT CLIP W SUCTION CUP,0.3746,1
10124A,10124G,ARMY CAMO BOOKCOVER TAPE,0.3566,2
10124A,16169D,WRAP WINTER FOREST,0.2667,3
10124A,20620,RED SPOTTY PASSPORT COVER,0.1732,4
10124A,20721,OWLS CHARLOTTE BAG,0.1732,5
10124A,35945,GOLD CHRISTMAS STOCKING DECORATION,0.1732,6
10124A,84311,CAMOFLAGE CUSHION COVER,0.1732,7
10124A,85043,RED HEART CANDY POP LIGHTS,0.1732,8
10124A,85171,S/2 HYACINTH BULB CANDLES,0.1732,9
10124A,23141,TRIPLE WIRE HOOK PINK HEART,0.1703,10
10124G,10124A,SPOTS ON RED BOOKCOVER TAPE,0.3566,1
10124G,20620,RED SPOTTY PASSPORT COVER,0.2106,2
10124G,20721,OWLS CHARLOTTE BAG,0.2106,3
10124G,35945,GOLD CHRISTMAS STOCKING DECORATION,0.2106,4
10124G,84311,CAMOFLAGE CUSHION COVER,0.2106,5
10124G,85043,RED HEART CANDY POP LIGHTS,0.2106,6
10124G,85171,S/2 HYACINTH BULB CANDLES,0.2106,7
10124G,23141,TRIPLE WIRE HOOK PINK HEART,0.2071,8
10124G,84030C,KNITTED RAINBOW HOT WATER BOTTLE,0.1986,9
10124G,85095,THREE CANVAS LUGGAGE TAGS,0.1868,10
10125,23224,CHERUB HEART DECORATION GOLD,0.6551,1
10125,23222,CHRISTMAS TREE HANGING GOLD,0.6472,2
10125,23007,SPACEBOY BABY GIFT SET,0.5215,3
10125,23010,CIRCUS PARADE BABY GIFT SET,0.5079,4
10125,23009,I LOVE LONDON BABY GIFT SET,0.4996,5
10125,20682,RED SPOTTY CHILDS UMBRELLA,0.4116,6
10125,22398,MAGNETS PACK OF 4 SWALLOWS,0.3303,7
10125,44241C,BLUE BUTTERFLY ON SPRING,0.2913,8
10125,22559,SEASIDE FRISBEE,0.2279,9
10125,21399,BLUE  SPOTTY  COFFEE MUG,0.2127,10
10133,22936,BAKING MOULD ROSE WHITE CHOCOLATE,0.4022,1
10133,20715,LITTLE FLOWER SHOPPER BAG,0.3976,2
10133,37345,ASSTD HEARTS DESIGN MUGS,0.3966,3
10133,23046,PAPER LANTERN 9 POINT DELUXE STAR,0.3961,4
10133,20913,SET/5 BLUE SPOTTY LID GLASS BOWLS,0.396,5
10133,84798A,PINK FOXGLOVE ARTIIFCIAL FLOWER,0.3948,6
10133,21438,TUB 24 HANGING EASTER EGGS SPOTTY,0.3931,7
10133,23040,PAPER LANTERN 9 POINT SNOW STAR,0.3928,8
10133,21477,STRING OF 20 ROSE LIGHTS,0.3922,9
10133,84849D,HOT BATHS SOAP HOLDER,0.3908,10
10134,20715,LITTLE FLOWER SHOPPER BAG,0.7885,1
10134,37345,ASSTD HEARTS DESIGN MUGS,0.7853,2
10134,20913,SET/5 BLUE SPOTTY LID GLASS BOWLS,0.7849,3
10134,22936,BAKING MOULD ROSE WHITE CHOCOLATE,0.7833,4
10134,84798A,PINK FOXGLOVE ARTIIFCIAL FLOWER,0.7829,5
10134,23046,PAPER LANTERN 9 POINT DELUXE STAR,0.7826,6
10134,21438,TUB 24 HANGING EASTER EGGS SPOTTY,0.7774,7
10134,21477,STRING OF 20 ROSE LIGHTS,0.7728,8
10134,23040,PAPER LANTERN 9 POINT SNOW STAR,0.7697,9
10134,84849D,HOT BATHS SOAP HOLDER,0.7646,10
10135,21709,FOLDING UMBRELLA  CHOC/WHITE  SPOT,0.7955,1
10135,21707,"FOLDING UMBRELLA , BLACK/BLUE  SPOT",0.7588,2
10135,21312,LARGE CHUNKY GLASS ROMAN BOWL,0.7045,3
10135,21316,SMALL CHUNKY GLASS ROMAN  BOWL,0.5793,4
10135,21869,POTTING SHED COFFEE MUG,0.5498,5
10135,85114B,IVORY ENCHANTED FOREST PLACEMAT,0.4318,6
10135,18097C,WHITE TALL PORCELAIN T-LIGHT HOLDER,0.3713,7
10135,84792,ENCHANTED BIRD COATHANGER 5 HOOK,0.2596,8
10135,10134,COLOURING PENCILS BROWN TUBE,0.2269,9
10135,21622,VINTAGE UNION JACK CUSHION COVER,0.2061,10
10138,20885,BOX OF 3 PEBBLE CANDLES,0.8995,1
10138,22124,SET OF 2 TEA TOWELS PING MICROWAVE,0.4629,2
10138,21685,MEDINA STAMPED METAL TRAY,0.4023,3
10138,84751B,BLACK MEDIUM GLASS CAKE STAND,0.318,4
10138,20942,SET/6 GINGERBREAD TREE T-LIGHTS,0.2844,5
10138,16169F,WRAP BLIZZARD,0.257,6
10138,85136A,YELLOW SHARK HELICOPTER,0.2484,7
10138,90190A,SILVER/CRYSTAL DROP EARRINGS W LEAF,0.2285,8
10138,21353,SILVER SLEIGHBELL  WREATH,0.2153,9
10138,20976,12 PENCILS SMALL TUBE POSY,0.2015,10
11001,23215,JINGLE BELL HEART ANTIQUE SILVER,0.9639,1
11001,20783,HEART EAR MUFF HEADPHONES,0.9381,2
11001,22991,GIRAFFE WOODEN RULER,0.9267,3
11001,22191,EAU DE NIL DINER WALL CLOCK,0.926,4
11001,10002,INFLATABLE POLITICAL GLOBE,0.9028,5
11001,22150,3 STRIPEY MICE FELTCRAFT,0.8957,6
11001,20972,PINK CREAM FELT CRAFT TRINKET BOX,0.8793,7
11001,21428,SET3 BOOK BOX GREEN GINGHAM FLOWER,0.8757,8
11001,22604,SET OF 4 NAPKIN CHARMS CUTLERY,0.8612,9
11001,84879,ASSORTED COLOUR BIRD ORNAMENT,0.8602,10
15030,84795E,RIO PINK STRIPE HAMMOCK,0.364,1
15030,20822,SILVER WINE GOBLET,0.2547,2
15030,72728,ROSE SCENT CANDLES IN GLASS,0.2259,3
15030,35598C,WHITE CHRISTMAS TREE 60CM,0.2206,4
15030,84711A,SILVER OVAL SHAPE TRINKET BOX,0.2016,5
15030,84429A,MEDIUM PINK BUDDHA HEAD,0.1645,6
15030,84201B,HAPPY BIRTHDAY CARD STRIPEY TEDDY,0.156,7
15030,84732B,CUTE BIRD CEATURE SCREEN,0.1249,8
15030,84732D,CUTE RABBIT CEATURE SCREEN,0.1215,9
15030,51014A,"FEATHER PEN,HOT PINK",0.1122,10
15034,16207B,PINK HEART RED HANDBAG,0.5662,1
15034,21633,SUNFLOWER DECORATIVE PARASOL,0.5508,2
15034,84660A,WHITE STITCHED WALL CLOCK,0.5465,3
15034,84720,DOT MATRIX CANVAS ART PICTURE,0.5449,4
15034,17013C,ORIGAMI LAVENDER INCENSE IN TUBE,0.5399,5
15034,72801D,S/4 SKY BLUE DINNER CANDLES,0.5363,6
15034,51020B,STRIPY DESIGN SHOWER CAP,0.5356,7
15034,84509E,CAROUSEL PLACEMATS,0.5348,8
15034,22104,MIRROR MOSAIC CANDLE PLATE,0.5322,9
15034,85221,ASSORTED COLOUR SILK COIN PURSE,0.531,10
15036,22348,TEA BAG PLATE RED SPOTTY,0.5441,1
15036,20952,PORCELAIN CHERUB BELL SMALL,0.5171,2
15036,20828,GLITTER BUTTERFLY CLIPS,0.5136,3
15036,22652,TRAVEL SEWING KIT,0.5048,4
15036,23568,EGG CUP HENRIETTA HEN CREAM,0.501,5
15036,21844,RETRO SPOT MUG,0.5002,6
15036,21531,RETRO SPOT SUGAR JAM BOWL,0.4982,7
15036,23566,EGG CUP MILKMAID HEIDI,0.4979,8
15036,22713,CARD I LOVE LONDON,0.4976,9
15036,22361,GLASS JAR DAISY FRESH COTTON WOOL,0.4964,10
15039,85060,WOOD FAN WITH FLOWER DESIGN,0.5209,1
15039,79000,MOROCCAN TEA GLASS,0.4669,2
15039,17013C,ORIGAMI LAVENDER INCENSE IN TUBE,0.4152,3
15039,84660A,WHITE STITCHED WALL CLOCK,0.41,4
15039,84313C,ORANGE TV TRAY TABLE,0.4093,5
15039,84509E,CAROUSEL PLACEMATS,0.4091,6
15039,84660B,BLACK STITCHED WALL CLOCK,0.4091,7
15039,84663A,GRASS HOPPER WOODEN WALL CLOCK,0.409,8
15039,85230A,OPIUM SCENTED VOTIVE CANDLE,0.4089,9
15039,72225C,LAVENDER SCENT CAKE CANDLE,0.4065,10
15044A,21732,RED HANGING METAL STAR TLIGHT HLDR,0.9917,1
15044A,21064,BOOM BOX SPEAKER BOYS,0.9694,2
15044A,15044B,BLUE PAPER PARASOL,0.9109,3
15044A,22567,20 DOLLY PEGS RETROSPOT,0.7291,4
15044A,47574B,ENGLISH ROSE SCENTED HANGING HEART,0.3253,5
15044A,84765,SILVER ROCOCO CANDELABRA,0.2598,6
15044A,22659,LUNCHBOX I LOVE LONDON,0.1525,7
15044A,21829,DINOSAUR KEYRINGS ASSORTED,0.1488,8
15044A,21830,ASSORTED CREEPY CRAWLIES,0.1116,9
15044A,84948,SILVER HANGING T-LIGHT HOLDER DOME,0.0998,10
15044B,15044A,PINK PAPER PARASOL,0.9109,1
15044B,21732,RED HANGING METAL STAR TLIGHT HLDR,0.8738,2
15044B,21064,BOOM BOX SPEAKER BOYS,0.8539,3
15044B,22567,20 DOLLY PEGS RETROSPOT,0.7272,4
15044B,21506,"FANCY FONT BIRTHDAY CARD,",0.3695,5
15044B,16156S,WRAP PINK FAIRY CAKES,0.3638,6
15044B,22659,LUNCHBOX I LOVE LONDON,0.3611,7
15044B,20828,GLITTER BUTTERFLY CLIPS,0.3504,8
15044B,20952,PORCELAIN CHERUB BELL SMALL,0.349,9
15044B,22361,GLASS JAR DAISY FRESH COTTON WOOL,0.3432,10
15044C,17013B,ORIGAMI JASMINE INCENSE IN TUBE,0.7943,1
15044C,15044D,RED PAPER PARASOL,0.6361,2
15044C,35001G,HAND OPEN SHAPE GOLD,0.6291,3
15044C,16207B,PINK HEART RED HANDBAG,0.5996,4
15044C,72225D,VANILLA SCENT CAKE CANDLE,0.5898,5
15044C,84720,DOT MATRIX CANVAS ART PICTURE,0.5895,6
15044C,22104,MIRROR MOSAIC CANDLE PLATE,0.5885,7
15044C,72801D,S/4 SKY BLUE DINNER CANDLES,0.588,8
15044C,72800C,S/4 PINK DINNER CANDLE SILVER FLOCK,0.5851,9
15044C,21076,SET/20 COLLAGE PAPER NAPKIN,0.5818,10
15044D,15044C,PURPLE PAPER PARASOL,0.6361,1
15044D,21200,MULTICOLOUR HONEYCOMB PAPER GARLAND,0.4826,2
15044D,21192,WHITE BELL HONEYCOMB PAPER,0.4783,3
15044D,16156S,WRAP PINK FAIRY CAKES,0.4763,4
15044D,17013B,ORIGAMI JASMINE INCENSE IN TUBE,0.4761,5
15044D,22993,SET OF 4 PANTRY JELLY MOULDS,0.4726,6
15044D,23318,BOX OF 6 MINI VINTAGE CRACKERS,0.4658,7
15044D,84843,WHITE SOAP RACK WITH 2 BOTTLES,0.4545,8
15044D,21201,TROPICAL  HONEYCOMB PAPER GARLAND,0.4396,9
15044D,40016,CHINESE DRAGON PAPER LANTERNS,0.4296,10
15056BL,15056N,EDWARDIAN PARASOL NATURAL,0.9206,1
15056BL,85014B,RED/WHITE DOTS RUFFLED UMBRELLA,0.8645,2
15056BL,20679,EDWARDIAN PARASOL RED,0.8496,3
15056BL,85014A,BLACK/BLUE DOTS RUFFLED UMBRELLA,0.8265,4
15056BL,21527,RETRO SPOT TRADITIONAL TEAPOT,0.8076,5
15056BL,15056P,EDWARDIAN PARASOL PINK,0.8049,6
15056BL,23284,DOORMAT KEEP CALM AND COME IN,0.8024,7
15056BL,22365,DOORMAT RESPECTABLE HOUSE,0.799,8
15056BL,22690,DOORMAT HOME SWEET HOME BLUE,0.7965,9
15056BL,21523,FANCY FONT HOME SWEET HOME DOORMAT,0.7925,10
15056N,15056BL,EDWARDIAN PARASOL BLACK,0.9206,1
15056N,85014B,RED/WHITE DOTS RUFFLED UMBRELLA,0.8379,2
15056N,15056P,EDWARDIAN PARASOL PINK,0.8329,3
15056N,85014A,BLACK/BLUE DOTS RUFFLED UMBRELLA,0.8273,4
15056N,20679,EDWARDIAN PARASOL RED,0.8209,5
15056N,21523,FANCY FONT HOME SWEET HOME DOORMAT,0.801,6
15056N,22690,DOORMAT HOME SWEET HOME BLUE,0.7994,7
15056N,22365,DOORMAT RESPECTABLE HOUSE,0.795,8
15056N,23284,DOORMAT KEEP CALM AND COME IN,0.7884,9
15056N,21955,UNION JACK GUNS & ROSES  DOORMAT,0.7696,10
15056P,20679,EDWARDIAN PARASOL RED,0.9203,1
15056P,21955,UNION JACK GUNS & ROSES  DOORMAT,0.8822,2
15056P,85014A,BLACK/BLUE DOTS RUFFLED UMBRELLA,0.8733,3
15056P,85014C,BLUE/BROWN DOTS RUFFLED UMBRELLA,0.8726,4
15056P,22189,CREAM HEART CARD HOLDER,0.8705,5
15056P,85014D,PINK/BROWN DOTS RUFFLED UMBRELLA,0.8705,6
15056P,21000,ROSE DU SUD COSMETICS BAG,0.8682,7
15056P,21444,BLUE CHALET BIRDFEEDER,0.868,8
15056P,85064,CREAM SWEETHEART LETTER RACK,0.8678,9
15056P,37482B,CUBIC MUG BLUE POLKA DOT,0.8671,10
15058A,15058B,PINK WHITE SPOTS GARDEN PARASOL,0.8197,1
15058A,22501,PICNIC BASKET WICKER LARGE,0.413,2
15058A,37441,ASSORTED WHITE EMBOSSED CHINA MUGS,0.3995,3
15058A,21430,SET/3 RED GINGHAM ROSE STORAGE BOX,0.2488,4
15058A,84837,WHITE SWEETHEARTS CABINET 4 DRAWERS,0.2462,5
15058A,84751B,BLACK MEDIUM GLASS CAKE STAND,0.2409,6
15058A,84795C,OCEAN STRIPE HAMMOCK,0.2214,7
15058A,47552A,DOTS IRONING BOARD COVER,0.2182,8
15058A,35930,PINK HEART CHRISTMAS DECORATION,0.2181,9
15058A,35974,S/6 CHRISTMAS TREE PLACE SETTING,0.2181,10
15058B,15058A,BLUE WHITE SPOTS GARDEN PARASOL,0.8197,1
15058B,22501,PICNIC BASKET WICKER LARGE,0.6738,2
15058B,84837,WHITE SWEETHEARTS CABINET 4 DRAWERS,0.3952,3
15058B,84751B,BLACK MEDIUM GLASS CAKE STAND,0.3905,4
15058B,21217,RED SPOTTY ROUND CAKE TINS,0.3104,5
15058B,21430,SET/3 RED GINGHAM ROSE STORAGE BOX,0.2976,6
15058B,20958,PORCELAIN HANGING BELL LARGE,0.2641,7
15058B,20957,PORCELAIN HANGING BELL SMALL,0.2422,8
15058B,47566,PARTY BUNTING,0.2324,9
15058B,22087,PAPER BUNTING WHITE LACE,0.229,10
15058C,62095B,TURQOISE ICE CREAM SUNHAT,0.6685,1
15058C,84802B,PURPLE ANEMONE ARTIFICIAL FLOWER,0.6377,2
15058C,84414B,FUSCHIA/GREEN STRIPE WOOLLY BLANKET,0.6148,3
15058C,72801D,S/4 SKY BLUE DINNER CANDLES,0.609,4
15058C,84748,FOLK FELT HANGING MULTICOL GARLAND,0.5995,5
15058C,84859B,BLUE DISCO HANDBAG,0.5967,6
15058C,84807,RED POPPY ARTIFICIAL FLOWER,0.5958,7
15058C,37492D,PURPLE GREEN FLOWER PIGGY BANK,0.5946,8
15058C,47587A,PINK FAIRY CAKE COASTER,0.5945,9
15058C,35816B,"ACRYLIC JEWEL ANGEL,BLUE",0.5939,10
15059A,22790,"MIRROR, ARCHED GEORGIAN",1.0,1
15059A,48175,DOOR MAT CAMOUFLAGE,1.0,2
15059A,85128,PLANTPOT SINGLE HOOK PISTACHIO,1.0,3
15059A,37482B,CUBIC MUG BLUE POLKA DOT,1.0,4
15059A,21308,LOUVRE VANITY MIRROR,0.9998,5
15059A,84767,ZINC POLICE BOX LANTERN,0.9998,6
15059A,22830,UTILTY CABINET WITH HOOKS,0.9998,7
15059A,23134,LARGE ZINC HEART WALL ORGANISER,0.9998,8
15059A,23135,SMALL ZINC HEART WALL ORGANISER,0.9996,9
15059A,22833,HALL CABINET WITH 3 DRAWERS,0.9995,10
15060B,21261,GREEN GOOSE FEATHER CHRISTMAS TREE,0.3714,1
15060B,20678,LARGE BLACK DIAMANTE HAIRSLIDE,0.3607,2
15060B,90076,MONTANA DIAMOND CLUSTER EARRINGS,0.3607,3
15060B,90141D,ROSE PENDANT TRIPLE SHELL NECKLACE,0.3607,4
15060B,22266,EASTER DECORATION HANGING BUNNY,0.3583,5
15060B,90177A,CLASSIC DIAMANTE EARRINGS JET,0.3558,6
15060B,84867A,PINK BABY GIRLS PHOTO ALBUM,0.3546,7
15060B,84683,CLASSICAL ROSE CANDLESTAND,0.3532,8
15060B,35598B,BLACK CHRISTMAS TREE 60CM,0.3528,9
15060B,90177E,DROP DIAMANTE EARRINGS GREEN,0.3521,10
16008,17014E,ORIGAMI OPIUM INCENSE CONES,0.6794,1
16008,17014F,ORIGAMI SANDLEWOOD INCENSE CONES,0.679,2
16008,17013F,ORIGAMI SANDLEWOOD INCENSE IN TUBE,0.6785,3
16008,17011B,ORIGAMI JASMINE INCENSE+FLOWER,0.668,4
16008,17011A,ORIGAMI VANILLA INCENSE+FLOWER,0.5487,5
16008,47422,ASSORTED MONKEY SUCTION CUP HOOK,0.4278,6
16008,22315,200 RED + WHITE BENDY STRAWS,0.4243,7
16008,84673A,PINK FLY SWAT,0.415,8
16008,40001,WHITE BAMBOO RIBS LAMPSHADE,0.4129,9
16008,85163B,BLACK BAROQUE WALL CLOCK,0.399,10
16010,35930,PINK HEART CHRISTMAS DECORATION,0.8706,1
16010,35974,S/6 CHRISTMAS TREE PLACE SETTING,0.8706,2
16010,90154,LAZER CUT NECKLACE W PASTEL BEADS,0.8693,3
16010,90149,SILVER FLOWR PINK SHELL NECKLACE,0.8674,4
16010,72803A,ROSE SCENT CANDLE JEWELLED DRAWER,0.8546,5
16010,22071,SMALL RETRO SPOT MUG IN BOX  WHITE,0.8207,6
16010,22070,SMALL RETRO SPOT MUG IN BOX  RED,0.8067,7
16010,37479P,CUBIC MUG FLOCK PINK ON BROWN,0.7836,8
16010,23072,MARIE ANTOINETTE TRINKET BOX SILVER,0.7749,9
16010,23071,MARIE ANTOIENETT TRINKET BOX GOLD,0.7376,10
16011,90004A,JADE GREEN PAIR ENAMEL HAIR SLIDES,0.8427,1
16011,84536A,ENGLISH ROSE NOTEBOOK A7 SIZE,0.7099,2
16011,21830,ASSORTED CREEPY CRAWLIES,0.554,3
16011,21829,DINOSAUR KEYRINGS ASSORTED,0.5225,4
16011,16256C,HEARTS PENCIL/RUBBER+5 MINI PENCILS,0.4129,5
16011,90059E,DIAMANTE HAIR GRIP PACK/2 RUBY,0.4048,6
16011,90059C,DIAMANTE HAIR GRIP PACK/2 MONTANA,0.3384,7
16011,84899E,YELLOW + BROWN BEAR FELT PURSE KIT,0.3144,8
16011,21224,SET/4 SKULL BADGES,0.2832,9
16011,84670,JAPANESE CROCHETED ANIMAL,0.2549,10
16012,21723,ALPHABET HEARTS STICKER SHEET,0.4582,1
16012,37348,SET OF 4 PASTEL STACKING MUGS,0.4447,2
16012,21017,RED BIRD HOUSE TREE DECORATION,0.4119,3
16012,21677,HEARTS  STICKERS,0.2914,4
16012,23185,FRENCH STYLE STORAGE JAR JAM,0.2579,5
16012,22133,PINK LOVE HEART SHAPE CUP,0.242,6
16012,47592B,SCOTTIES DESIGN CHILD'S OVERALL,0.194,7
16012,47518F,ICON PLACEMAT POP ART ELVIS,0.1918,8
16012,22547,MINI JIGSAW DINOSAUR,0.1897,9
16012,51014A,"FEATHER PEN,HOT PINK",0.1733,10
16014,16015,MEDIUM CHINESE STYLE SCISSOR,0.1008,1
16014,16016,LARGE CHINESE STYLE SCISSOR,0.0852,2
16014,23377,PACK OF 12 DOLLY GIRL TISSUES,0.0124,3
16014,90039C,FIRE POLISHED GLASS BRACELET BLACK,0.0115,4
16014,90039A,FIRE POLISHED GLASS BRACELET RED,0.0114,5
16014,21341,KASBAH LANTERN WITH GLASS,0.0108,6
16014,90039D,FIRE POLISHED GLASS BRACELET GREEN,0.0106,7
16014,90039B,FIRE POLISHED GLASS BRACELET MONTAN,0.0089,8
16014,17014E,ORIGAMI OPIUM INCENSE CONES,0.0074,9
16014,17014F,ORIGAMI SANDLEWOOD INCENSE CONES,0.0074,10
16015,84387A,BIRD ON BRANCH CANVAS SCREEN,0.8513,1
16015,75178,ASSTD COL BUTTERFLY/CRYSTAL W/CHIME,0.8507,2
16015,84858A,NATURAL RIVIERA HANDBAG,0.8455,3
16015,72793,BLACK BOX MIRROR LANTERN,0.8443,4
16015,90125C,TURQUOISE BERTIE GLASS BEAD CHARM,0.8393,5
16015,71510,SQUARE METAL CANDLEHOLDER BASE,0.8365,6
16015,90125D,PURPLE BERTIE GLASS BEAD BAG CHARM,0.8341,7
16015,16168S,FUNKY MONKEY GIFT BAG SMALL,0.8326,8
16015,21065,BOOM BOX SPEAKER GIRLS,0.8326,9
16015,84805A,CREAM CLIMBING HYDRANGA ART FLOWER,0.8289,10
16016,22299,PIG KEYRING WITH LIGHT & SOUND,0.8144,1
16016,84797B,BLUE SAVANNAH PICNIC HAMPER FOR 4,0.7671,2
16016,47021G,SET/6 BEAD COASTERS GAUZE BAG GOLD,0.743,3
16016,22575,METAL MERRY CHRISTMAS WREATH,0.7243,4
16016,84797A,PINK HAWAIIAN PICNIC HAMPER FOR 4,0.6403,5
16016,82616A,BUBBLE GUM SCARF KNITTING KIT,0.624,6
16016,17014D,ORIGAMI ROSE INCENSE CONES,0.6157,7
16016,84796A,PINK HAWAIIAN PICNIC HAMPER FOR 2,0.5652,8
16016,22738,RIBBON REEL SNOWY VILLAGE,0.5548,9
16016,23301,GARDENERS KNEELING PAD KEEP CALM,0.5314,10
16020C,21742,LARGE ROUND WICKER PLATTER,0.3759,1
16020C,84899F,YELLOW PURPLE DAISY FELT PURSE KIT,0.2841,2
16020C,84891B,GREEN WIRE GOBLET CANDLEHOLDER,0.2641,3
16020C,20667,CHERRY BLOSSOM PURSE,0.2338,4
16020C,20664,TROPICAL HOLIDAY PURSE,0.2066,5
16020C,85136C,RED SHARK HELICOPTER,0.1946,6
16020C,16162M,THE KING GIFT BAG 25X24X12CM,0.1745,7
16020C,84201B,HAPPY BIRTHDAY CARD STRIPEY TEDDY,0.1681,8
16020C,79149B,SILICON STAR BULB  BLUE,0.163,9
16020C,21473,SWEETHEART CREAM STEEL TABLE RECT,0.1456,10
16033,21577,SAVE THE PLANET COTTON TOTE BAG,0.8019,1
16033,22146,EASTER CRAFT IVY WREATH WITH CHICK,0.7732,2
16033,22537,MAGIC DRAWING SLATE DINOSAUR,0.7705,3
16033,22436,12 COLOURED PARTY BALLOONS,0.7261,4
16033,22402,MAGNETS PACK OF 4 VINTAGE COLLAGE,0.6955,5
16033,22434,BALLOON PUMP WITH 10 BALLOONS,0.6345,6
16033,21077,SET/20 WOODLAND PAPER NAPKINS,0.6196,7
16033,22534,MAGIC DRAWING SLATE SPACEBOY,0.5981,8
16033,21611,SET OF 12 LILY BOTANICAL T-LIGHTS,0.5886,9
16033,22530,MAGIC DRAWING SLATE DOLLY GIRL,0.5697,10
16043,16162L,THE KING GIFT BAG,0.9983,1
16043,21096,SET/6 FRUIT SALAD  PAPER PLATES,0.9974,2
16043,21082,SET/20 FRUIT SALAD PAPER NAPKINS,0.9974,3
16043,10123G,ARMY CAMO WRAPPING TAPE,0.9973,4
16043,85160A,WHITE BIRD GARDEN DESIGN MUG,0.9972,5
16043,84493,BLUE/PINK NEST STRIPE BOX,0.9972,6
16043,37444B,BLUE BREAKFAST CUP AND SAUCER,0.9972,7
16043,84924F,PSYCHEDELIC METAL SIGN CALENDAR,0.9972,8
16043,85160B,BLACK BIRD GARDEN DESIGN MUG,0.9972,9
16043,21392,RED SPOTTY PUDDING BOWL,0.9972,10
16044,37351,ORANGE FLOWER MUG,1.0,1
16044,20800,LARGE GLASS SUNDAE DISH CLEAR,1.0,2
16044,37352,BIRD IN TREE MUG,1.0,3
16044,47503E,ASS FLORAL PRINT SCISSORS,1.0,4
16044,20775,DAISY NOTEBOOK,1.0,5
16044,37379B,BLUE CHERRY BLOSSOM CUP & SAUCER,0.9999,6
16044,20776,ABSTRACT CIRCLES NOTEBOOK,0.9999,7
16044,20774,GREEN FERN NOTEBOOK,0.9999,8
16044,21092,SET/6 STRAWBERRY PAPER PLATES,0.9999,9
16044,47503F,ASS FLORAL PRINT TORCH,0.9999,10
16045,21641,ASSORTED TUTTI FRUTTI KEYRING BALL,0.4179,1
16045,16054,POPART RECT PENCIL SHARPENER ASST,0.4096,2
16045,21851,LILAC DIAMANTE PEN IN GIFT BOX,0.3859,3
16045,22110,BIRD HOUSE HOT WATER BOTTLE,0.3834,4
16045,16048,TEATIME ROUND PENCIL SHARPENER,0.382,5
16045,16218,CARTOON  PENCIL SHARPENERS,0.3721,6
16045,71496A,A4 WALL TIDY BLUE OFFICE,0.372,7
16045,85025C,PINK HEART SHAPE PHOTO FRAME,0.3706,8
16045,22608,PENS ASSORTED FUNKY JEWELED,0.3677,9
16045,20619,TROPICAL PASSPORT COVER,0.3593,10
16046,37444A,YELLOW BREAKFAST CUP AND SAUCER,0.9994,1
16046,85160A,WHITE BIRD GARDEN DESIGN MUG,0.9993,2
16046,84493,BLUE/PINK NEST STRIPE BOX,0.9993,3
16046,37444B,BLUE BREAKFAST CUP AND SAUCER,0.9993,4
16046,84924F,PSYCHEDELIC METAL SIGN CALENDAR,0.9993,5
16046,10123G,ARMY CAMO WRAPPING TAPE,0.9993,6
16046,85160B,BLACK BIRD GARDEN DESIGN MUG,0.9993,7
16046,84924D,LA PALMIERA METAL SIGN CALENDAR,0.9993,8
16046,21392,RED SPOTTY PUDDING BOWL,0.9993,9
16046,16047,POP ART PEN CASE & PENS,0.9993,10
16047,85160A,WHITE BIRD GARDEN DESIGN MUG,0.9999,1
16047,84493,BLUE/PINK NEST STRIPE BOX,0.9999,2
16047,37444B,BLUE BREAKFAST CUP AND SAUCER,0.9999,3
16047,84924F,PSYCHEDELIC METAL SIGN CALENDAR,0.9999,4
16047,85160B,BLACK BIRD GARDEN DESIGN MUG,0.9999,5
16047,84924D,LA PALMIERA METAL SIGN CALENDAR,0.9999,6
16047,21392,RED SPOTTY PUDDING BOWL,0.9999,7
16047,10123G,ARMY CAMO WRAPPING TAPE,0.9999,8
16047,84847,FLORAL BATHROOM SET,0.9999,9
16047,37471,MULTICOLOUR DOTS PLATE,0.9998,10
16048,84907,PINK/YELLOW PATCH CUSHION COVER,0.9474,1
16048,84631,FRUIT TREE AND BIRDS WALL PLAQUE,0.9465,2
16048,72753A,S/3 FLWR FAIRY LILLY CANDLES,0.9456,3
16048,17011C,ORIGAMI LAVENDER INCENSE+FLOWER,0.9448,4
16048,17011E,ORIGAMI OPIUM SCENT INCENSE+FLOWER,0.9448,5
16048,22864,MUG AND COASTER SET RED CIRCLES,0.9448,6
16048,35822B,"ACRYLIC BEAD CHAIN, BLUE",0.9448,7
16048,35822P,"ACRYLIC BEAD CHAIN, PINK",0.9448,8
16048,79308B,MOSAIC CANDLE DISH BLUE PURPLE,0.9448,9
16048,84857B,BLUE MONTE CARLO HANDBAG,0.9448,10
16049,20701,PINK CAT FLORAL CUSHION COVER,0.9258,1
16049,84907,PINK/YELLOW PATCH CUSHION COVER,0.925,2
16049,16239,BALLERINA HEART DECORATION.,0.9249,3
16049,16151A,FLOWER DES BLUE HANDBAG/ORANG HANDL,0.9237,4
16049,16048,TEATIME ROUND PENCIL SHARPENER,0.9216,5
16049,47585A,PINK FAIRY CAKE CUSHION COVER,0.9215,6
16049,47587A,PINK FAIRY CAKE COASTER,0.9202,7
16049,72753B,S/3 FLWR FAIRY LAVENDER CANDLES,0.9194,8
16049,17011C,ORIGAMI LAVENDER INCENSE+FLOWER,0.9193,9
16049,17011E,ORIGAMI OPIUM SCENT INCENSE+FLOWER,0.9193,10
16050,84746,PINK EASTER HENS+FLOWER,0.3652,1
16050,21693,SMALL HAMMERED SILVER CANDLEPOT,0.2707,2
16050,85130A,BEADED PEARL HEART WHITE LARGE,0.2604,3
16050,20855,PINK PATCH PURSE BLUE HEART,0.2184,4
16050,84899F,YELLOW PURPLE DAISY FELT PURSE KIT,0.2114,5
16050,85129A,"WHITE PEARL BEADED HEART, SMALL",0.1754,6
16050,21034,REX CASH+CARRY JUMBO SHOPPER,0.17,7
16050,22642,SET OF 4 NAPKIN CHARMS STARS,0.168,8
16050,21440,12 MINI TOADSTOOL PEGS,0.1641,9
16050,85142,JARDIN ETCHED GLASS GINGER JAR,0.1618,10
16051,37351,ORANGE FLOWER MUG,0.9983,1
16051,20800,LARGE GLASS SUNDAE DISH CLEAR,0.9983,2
16051,37352,BIRD IN TREE MUG,0.9983,3
16051,47503E,ASS FLORAL PRINT SCISSORS,0.9983,4
16051,37379B,BLUE CHERRY BLOSSOM CUP & SAUCER,0.9982,5
16051,16044,POP-ART FLUORESCENT PENS,0.9982,6
16051,20776,ABSTRACT CIRCLES NOTEBOOK,0.9982,7
16051,20775,DAISY NOTEBOOK,0.9982,8
16051,21092,SET/6 STRAWBERRY PAPER PLATES,0.9982,9
16051,20774,GREEN FERN NOTEBOOK,0.9982,10
16052,84721,MANHATTAN CANVAS ART PICTURE,0.9273,1
16052,72753A,S/3 FLWR FAIRY LILLY CANDLES,0.9267,2
16052,35816B,"ACRYLIC JEWEL ANGEL,BLUE",0.9255,3
16052,17011C,ORIGAMI LAVENDER INCENSE+FLOWER,0.925,4
16052,17011E,ORIGAMI OPIUM SCENT INCENSE+FLOWER,0.925,5
16052,22864,MUG AND COASTER SET RED CIRCLES,0.925,6
16052,35822B,"ACRYLIC BEAD CHAIN, BLUE",0.925,7
16052,35822P,"ACRYLIC BEAD CHAIN, PINK",0.925,8
16052,79308B,MOSAIC CANDLE DISH BLUE PURPLE,0.925,9
16052,84857B,BLUE MONTE CARLO HANDBAG,0.925,10
16053,85160B,BLACK BIRD GARDEN DESIGN MUG,0.9991,1
16053,84924D,LA PALMIERA METAL SIGN CALENDAR,0.9991,2
16053,85160A,WHITE BIRD GARDEN DESIGN MUG,0.9991,3
16053,37444B,BLUE BREAKFAST CUP AND SAUCER,0.9991,4
16053,84493,BLUE/PINK NEST STRIPE BOX,0.999,5
16053,16047,POP ART PEN CASE & PENS,0.999,6
16053,84924F,PSYCHEDELIC METAL SIGN CALENDAR,0.999,7
16053,10123G,ARMY CAMO WRAPPING TAPE,0.999,8
16053,84847,FLORAL BATHROOM SET,0.999,9
16053,21279,VINTAGE KITCHEN PRINT FRUITS,0.999,10
16054,22609,PENS ASSORTED SPACEBALL,0.4454,1
16054,16045,POPART WOODEN PENCILS ASST,0.4096,2
16054,16218,CARTOON  PENCIL SHARPENERS,0.3938,3
16054,21402,RED  EGG  SPOON,0.3778,4
16054,21530,DAIRY MAID CERAMIC TOASTRACK,0.3776,5
16054,22092,BLUE PAISLEY TISSUE BOX,0.3583,6
16054,22233,JIGSAW RABBIT AND BIRDHOUSE,0.3548,7
16054,22608,PENS ASSORTED FUNKY JEWELED,0.3514,8
16054,44242B,PINK FEATHERS CURTAIN,0.3372,9
16054,90103,PURPLE FRANGIPANI NECKLACE,0.3356,10
16119,85023B,EAU DE NILE JEWELLED PHOTOFRAME,0.9089,1
16119,85166B,BLACK METAL BAROQUE PHOTO FRAME,0.9062,2
16119,85167B,BLACK GRAND BAROQUE PHOTO FRAME,0.8729,3
16119,20996,JAZZ HEARTS ADDRESS BOOK,0.8685,4
16119,84601A,NEW BAROQUE IVORY CUSHION COVER,0.8471,5
16119,46137D,GREEN CHENILLE SHAGGY RUG,0.8255,6
16119,17011C,ORIGAMI LAVENDER INCENSE+FLOWER,0.8227,7
16119,17011E,ORIGAMI OPIUM SCENT INCENSE+FLOWER,0.8227,8
