StockCode,recommended_StockCode,recommended_Description,similarity_score,rank
16256C,40018E,TEA TIME PAPER LANTERNS,0.2245,8
16256C,21829,DINOSAUR KEYRINGS ASSORTED,0.2139,9
16256C,90059E,DIAMANTE HAIR GRIP PACK/2 RUBY,0.2116,10
16258A,20897,VINTAGE NOTEBOOK PARIS DAYS,0.7831,1
16258A,84601A,NEW BAROQUE IVORY CUSHION COVER,0.7499,2
16258A,85024B,EAU DE NILE JEWELLED PHOTOFRAME,0.7437,3
16258A,72753A,S/3 FLWR FAIRY LILLY CANDLES,0.7425,4
16258A,84631,FRUIT TREE AND BIRDS WALL PLAQUE,0.7422,5
16258A,84984D,ORIENTAL RED C/COVER,0.7401,6
16258A,35816B,"ACRYLIC JEWEL ANGEL,BLUE",0.7387,7
16258A,79336,LIGHT PINK FLOCK GLASS CANDLEHOLDER,0.7387,8
16258A,84908A,PINK 5 PATCH FLOWER CUSHION COVER,0.7386,9
16258A,17011C,ORIGAMI LAVENDER INCENSE+FLOWER,0.7385,10
16258B,16244B,MAXWELL 2 TONE BLUE 60 PAGE PHOTO A,0.9698,1
16258B,16244A,MAXWELL 2 TONE PINK 60 PAGE PHOTO A,0.9638,2
16258B,72801G,S/4 BURGUNDY WINE DINNER CANDLES,0.9594,3
16258B,21942,SKULLS DESIGN FLANNEL,0.9569,4
16258B,21944,KITTENS DESIGN FLANNEL,0.948,5
16258B,78124,MAGAZINE RACK GEBRA ASSORTED,0.9445,6
16258B,84726,LILLIES CANVAS PICTURE,0.9282,7
16258B,16243B,BROWN COZY SQUARE PHOTO ALBUM,0.9266,8
16258B,72801E,S/4 FESTIVE GREEN DINNER CANDLES,0.9214,9
16258B,22096,PINK PAISLEY SQUARE TISSUE BOX,0.9183,10
16259,21402,RED  EGG  SPOON,0.3452,1
16259,21530,DAIRY MAID CERAMIC TOASTRACK,0.345,2
16259,16054,POPART RECT PENCIL SHARPENER ASST,0.3328,3
16259,22232,3 PIECE JIGSAW TOADSTOOLS,0.2735,4
16259,22187,GREEN CHRISTMAS TREE CARD HOLDER,0.2662,5
16259,22324,BLUE POLKADOT KIDS BAG,0.2544,6
16259,22233,JIGSAW RABBIT AND BIRDHOUSE,0.2538,7
16259,22092,BLUE PAISLEY TISSUE BOX,0.2469,8
16259,85130B,BEADED CRYSTAL HEART GREEN LARGE,0.2325,9
16259,90103,PURPLE FRANGIPANI NECKLACE,0.2323,10
17001,72225D,VANILLA SCENT CAKE CANDLE,0.9195,1
17001,16207B,PINK HEART RED HANDBAG,0.9173,2
17001,84720,DOT MATRIX CANVAS ART PICTURE,0.9144,3
17001,72800C,S/4 PINK DINNER CANDLE SILVER FLOCK,0.9139,4
17001,22104,MIRROR MOSAIC CANDLE PLATE,0.9125,5
17001,16216,LETTER SHAPE PENCIL SHARPENER,0.8998,6
17001,84869,CANDY BUTTON PHOTO ALBUM,0.899,7
17001,35637C,PINK STRING CURTAIN WITH POLE,0.8984,8
17001,72799C,PINK PILLAR CANDLE SILVER FLOCK,0.8981,9
17001,17011F,ORIGAMI SANDLEWOOD INCENSE+FLOWER,0.8976,10
17003,23139,SINGLE WIRE HOOK PINK HEART,0.7381,1
17003,84347,ROTATING SILVER ANGELS T-LIGHT HLDR,0.7164,2
17003,21161,KEEP OUT BOYS DOOR HANGER,0.6996,3
17003,23138,SINGLE WIRE HOOK IVORY HEART,0.6949,4
17003,22381,TOY TIDY PINK RETROSPOT,0.692,5
17003,22759,SET OF 3 NOTEBOOKS IN PARCEL,0.6617,6
17003,22379,RECYCLING BAG RETROSPOT,0.6396,7
17003,21163,DO NOT TOUCH MY STUFF DOOR HANGER,0.5874,8
17003,21380,WOODEN HAPPY BIRTHDAY GARLAND,0.5777,9
17003,22127,PARTY CONES CARNIVAL ASSORTED,0.5549,10
17007B,35930,PINK HEART CHRISTMAS DECORATION,0.437,1
17007B,35974,S/6 CHRISTMAS TREE PLACE SETTING,0.437,2
17007B,90154,LAZER CUT NECKLACE W PASTEL BEADS,0.4364,3
17007B,90149,SILVER FLOWR PINK SHELL NECKLACE,0.4354,4
17007B,72803A,ROSE SCENT CANDLE JEWELLED DRAWER,0.4294,5
17007B,22071,SMALL RETRO SPOT MUG IN BOX  WHITE,0.4115,6
17007B,22070,SMALL RETRO SPOT MUG IN BOX  RED,0.4047,7
17007B,23072,MARIE ANTOINETTE TRINKET BOX SILVER,0.3882,8
17007B,37479P,CUBIC MUG FLOCK PINK ON BROWN,0.3859,9
17007B,16010,FOLDING CAMPING SCISSOR W/KNIF & S,0.3805,10
17011A,17014E,ORIGAMI OPIUM INCENSE CONES,0.6691,1
17011A,17014F,ORIGAMI SANDLEWOOD INCENSE CONES,0.6687,2
17011A,17013F,ORIGAMI SANDLEWOOD INCENSE IN TUBE,0.6682,3
17011A,17011B,ORIGAMI JASMINE INCENSE+FLOWER,0.6579,4
17011A,16008,SMALL FOLDING SCISSOR(POINTED EDGE),0.5487,5
17011A,47504H,ENGLISH ROSE SPIRIT LEVEL,0.3996,6
17011A,22313,OFFICE MUG WARMER PINK,0.3883,7
17011A,17013D,ORIGAMI ROSE INCENSE IN TUBE,0.3822,8
17011A,84387A,BIRD ON BRANCH CANVAS SCREEN,0.3312,9
17011A,75178,ASSTD COL BUTTERFLY/CRYSTAL W/CHIME,0.3309,10
17011B,17013F,ORIGAMI SANDLEWOOD INCENSE IN TUBE,0.991,1
17011B,17014E,ORIGAMI OPIUM INCENSE CONES,0.9825,2
17011B,17014F,ORIGAMI SANDLEWOOD INCENSE CONES,0.982,3
17011B,16008,SMALL FOLDING SCISSOR(POINTED EDGE),0.668,4
17011B,17011A,ORIGAMI VANILLA INCENSE+FLOWER,0.6579,5
17011B,21520,BOOZE & WOMEN GREETING CARD,0.4149,6
17011B,23430,BLUE RETRO KITCHEN WALL CLOCK,0.3837,7
17011B,22614,PACK OF 12 SPACEBOY TISSUES,0.3533,8
17011B,23429,RED RETRO KITCHEN WALL CLOCK,0.3502,9
17011B,22994,TRAVEL CARD WALLET RETROSPOT,0.348,10
17011C,17011E,ORIGAMI OPIUM SCENT INCENSE+FLOWER,1.0,1
17011C,22864,MUG AND COASTER SET RED CIRCLES,1.0,2
17011C,35822B,"ACRYLIC BEAD CHAIN, BLUE",1.0,3
17011C,35822P,"ACRYLIC BEAD CHAIN, PINK",1.0,4
17011C,79308B,MOSAIC CANDLE DISH BLUE PURPLE,1.0,5
17011C,84857B,BLUE MONTE CARLO HANDBAG,1.0,6
17011C,84908B,BLUE 5 PATCH FLOWER CUSHION COVER,1.0,7
17011C,84908A,PINK 5 PATCH FLOWER CUSHION COVER,1.0,8
17011C,35817B,"ACRYLIC JEWEL SNOWFLAKE,BLUE",1.0,9
17011C,35816B,"ACRYLIC JEWEL ANGEL,BLUE",1.0,10
17011D,17011C,ORIGAMI LAVENDER INCENSE+FLOWER,0.997,1
17011D,17011E,ORIGAMI OPIUM SCENT INCENSE+FLOWER,0.997,2
17011D,22864,MUG AND COASTER SET RED CIRCLES,0.997,3
17011D,35822B,"ACRYLIC BEAD CHAIN, BLUE",0.997,4
17011D,35822P,"ACRYLIC BEAD CHAIN, PINK",0.997,5
17011D,79308B,MOSAIC CANDLE DISH BLUE PURPLE,0.997,6
17011D,84857B,BLUE MONTE CARLO HANDBAG,0.997,7
17011D,84908B,BLUE 5 PATCH FLOWER CUSHION COVER,0.997,8
17011D,84908A,PINK 5 PATCH FLOWER CUSHION COVER,0.9969,9
17011D,35817B,"ACRYLIC JEWEL SNOWFLAKE,BLUE",0.9969,10
17011E,17011C,ORIGAMI LAVENDER INCENSE+FLOWER,1.0,1
17011E,22864,MUG AND COASTER SET RED CIRCLES,1.0,2
17011E,35822B,"ACRYLIC BEAD CHAIN, BLUE",1.0,3
17011E,35822P,"ACRYLIC BEAD CHAIN, PINK",1.0,4
17011E,79308B,MOSAIC CANDLE DISH BLUE PURPLE,1.0,5
17011E,84857B,BLUE MONTE CARLO HANDBAG,1.0,6
17011E,84908B,BLUE 5 PATCH FLOWER CUSHION COVER,1.0,7
17011E,84908A,PINK 5 PATCH FLOWER CUSHION COVER,1.0,8
17011E,35817B,"ACRYLIC JEWEL SNOWFLAKE,BLUE",1.0,9
17011E,35816B,"ACRYLIC JEWEL ANGEL,BLUE",1.0,10
17011F,72225D,VANILLA SCENT CAKE CANDLE,0.9576,1
17011F,84631,FRUIT TREE AND BIRDS WALL PLAQUE,0.9471,2
17011F,84869,CANDY BUTTON PHOTO ALBUM,0.9468,3
17011F,37492B,BLUE YELLOW FLOWER PIGGY BANK,0.9444,4
17011F,35637A,IVORY STRING CURTAIN WITH POLE,0.943,5
17011F,22104,MIRROR MOSAIC CANDLE PLATE,0.9416,6
17011F,16207B,PINK HEART RED HANDBAG,0.9415,7
17011F,16216,LETTER SHAPE PENCIL SHARPENER,0.9403,8
17011F,17109A,FLOWER FAIRY INCENSE LILY,0.9395,9
17011F,17011C,ORIGAMI LAVENDER INCENSE+FLOWER,0.9394,10
17012A,16207B,PINK HEART RED HANDBAG,0.8511,1
17012A,84720,DOT MATRIX CANVAS ART PICTURE,0.8499,2
17012A,72225D,VANILLA SCENT CAKE CANDLE,0.8479,3
17012A,84595E,LARGE TORTILLA DESIGN RED BOWL,0.8471,4
17012A,22104,MIRROR MOSAIC CANDLE PLATE,0.845,5
17012A,85183A,CHARLIE & LOLA WASTEPAPER BIN BLUE,0.8318,6
17012A,85071D,CHARLIE+LOLA MY ROOM DOOR SIGN,0.831,7
17012A,90210C,RED   ACRYLIC FACETED BANGLE,0.8302,8
17012A,72801D,S/4 SKY BLUE DINNER CANDLES,0.8286,9
17012A,17011F,ORIGAMI SANDLEWOOD INCENSE+FLOWER,0.8274,10
17012B,17012F,ORIGAMI SANDLEWOOD INCENSE/CAND SET,0.5988,1
17012B,47503A,ASS FLORAL PRINT MULTI SCREWDRIVER,0.4313,2
17012B,17012A,ORIGAMI VANILLA INCENSE/CANDLE SET,0.4208,3
17012B,21014,SWISS CHALET TREE DECORATION,0.4203,4
17012B,84625A,PINK NEW BAROQUECANDLESTICK CANDLE,0.3982,5
17012B,85230B,CINNAMON SCENTED VOTIVE CANDLE,0.3878,6
17012B,85170B,SET/6 BLACK BIRD T-LIGHT CANDLES,0.3778,7
17012B,22376,AIRLINE BAG VINTAGE JET SET WHITE,0.3623,8
17012B,22609,PENS ASSORTED SPACEBALL,0.3467,9
17012B,21065,BOOM BOX SPEAKER GIRLS,0.338,10
17012C,17011C,ORIGAMI LAVENDER INCENSE+FLOWER,0.9556,1
17012C,17011E,ORIGAMI OPIUM SCENT INCENSE+FLOWER,0.9556,2
17012C,22864,MUG AND COASTER SET RED CIRCLES,0.9556,3
17012C,35822B,"ACRYLIC BEAD CHAIN, BLUE",0.9556,4
17012C,35822P,"ACRYLIC BEAD CHAIN, PINK",0.9556,5
17012C,79308B,MOSAIC CANDLE DISH BLUE PURPLE,0.9556,6
17012C,84857B,BLUE MONTE CARLO HANDBAG,0.9556,7
17012C,84908B,BLUE 5 PATCH FLOWER CUSHION COVER,0.9556,8
17012C,35816B,"ACRYLIC JEWEL ANGEL,BLUE",0.9556,9
17012C,84908A,PINK 5 PATCH FLOWER CUSHION COVER,0.9556,10
17012D,17108D,FLOWER FAIRY SUMMER BOUQUET SACHET,0.368,1
17012D,84877B,GREEN ROUND COMPACT MIRROR,0.3665,2
17012D,17012F,ORIGAMI SANDLEWOOD INCENSE/CAND SET,0.3373,3
17012D,35651,VINTAGE BEAD PINK SCARF,0.3321,4
17012D,22395,PAPERWEIGHT VINTAGE PAISLEY,0.3259,5
17012D,90086,CRYSTAL FROG PHONE CHARM,0.3233,6
17012D,23150,IVORY SWEETHEART SOAP DISH,0.3216,7
17012D,21992,VINTAGE PAISLEY STATIONERY SET,0.3076,8
17012D,21562,HAWAIIAN GRASS SKIRT,0.2986,9
17012D,17181,CIRCLE OF FRIENDS CANDLE HOLDER,0.2902,10
17012E,17011C,ORIGAMI LAVENDER INCENSE+FLOWER,0.9691,1
17012E,17011E,ORIGAMI OPIUM SCENT INCENSE+FLOWER,0.9691,2
17012E,22864,MUG AND COASTER SET RED CIRCLES,0.9691,3
17012E,35822B,"ACRYLIC BEAD CHAIN, BLUE",0.9691,4
17012E,35822P,"ACRYLIC BEAD CHAIN, PINK",0.9691,5
17012E,79308B,MOSAIC CANDLE DISH BLUE PURPLE,0.9691,6
17012E,84857B,BLUE MONTE CARLO HANDBAG,0.9691,7
17012E,84908B,BLUE 5 PATCH FLOWER CUSHION COVER,0.9691,8
17012E,84908A,PINK 5 PATCH FLOWER CUSHION COVER,0.969,9
17012E,35817B,"ACRYLIC JEWEL SNOWFLAKE,BLUE",0.969,10
17012F,17012B,ORIGAMI JASMINE INCENSE/CANDLE SET,0.5988,1
17012F,84625A,PINK NEW BAROQUECANDLESTICK CANDLE,0.4792,2
17012F,23453,OVAL  MINI PORTRAIT FRAME,0.411,3
17012F,84625C,BLUE NEW BAROQUE CANDLESTICK CANDLE,0.4012,4
17012F,47503A,ASS FLORAL PRINT MULTI SCREWDRIVER,0.3968,5
17012F,17012A,ORIGAMI VANILLA INCENSE/CANDLE SET,0.3942,6
17012F,21369,MIRRORED WALL ART SPLODGES,0.385,7
17012F,22376,AIRLINE BAG VINTAGE JET SET WHITE,0.3511,8
17012F,17012D,ORIGAMI ROSE INCENSE/CANDLE SET,0.3373,9
17012F,84823,DANISH ROSE FOLDING CHAIR,0.328,10
17013B,15044C,PURPLE PAPER PARASOL,0.7943,1
17013B,35001G,HAND OPEN SHAPE GOLD,0.7844,2
17013B,84952B,BLACK LOVE BIRD T-LIGHT HOLDER,0.7179,3
17013B,84952C,MIRROR LOVE BIRD T-LIGHT HOLDER,0.7163,4
17013B,85040B,SET/4 BLUE FLOWER CANDLES IN BOWL,0.714,5
17013B,37461,FUNKY MONKEY MUG,0.7136,6
17013B,20814,SILVER FINCH DECORATION,0.712,7
17013B,20825,GOLD WINE GLASS,0.711,8
17013B,23509,MINI PLAYING CARDS FUN FAIR,0.7065,9
17013B,21131,GOLD STANDING GNOME,0.7016,10
17013C,84509E,CAROUSEL PLACEMATS,0.9856,1
17013C,84720,DOT MATRIX CANVAS ART PICTURE,0.9816,2
17013C,16207B,PINK HEART RED HANDBAG,0.9713,3
17013C,72225C,LAVENDER SCENT CAKE CANDLE,0.9632,4
17013C,84660A,WHITE STITCHED WALL CLOCK,0.963,5
17013C,21040,MODERN VINTAGE COTTON SHOPPING BAG,0.9531,6
17013C,75011,BLUE DAISY MOBILE,0.9481,7
17013C,22104,MIRROR MOSAIC CANDLE PLATE,0.9447,8
17013C,84402B,PURPLE DRESS JEWELLERY STAND,0.9407,9
17013C,85230A,OPIUM SCENTED VOTIVE CANDLE,0.9351,10
17013D,84313C,ORANGE TV TRAY TABLE,0.8351,1
17013D,84660B,BLACK STITCHED WALL CLOCK,0.8256,2
17013D,85230A,OPIUM SCENTED VOTIVE CANDLE,0.817,3
17013D,17013C,ORIGAMI LAVENDER INCENSE IN TUBE,0.8131,4
17013D,84663A,GRASS HOPPER WOODEN WALL CLOCK,0.8118,5
17013D,72128,COLUMBIAN CANDLE ROUND,0.8031,6
17013D,72225C,LAVENDER SCENT CAKE CANDLE,0.8015,7
17013D,84509E,CAROUSEL PLACEMATS,0.7984,8
17013D,84660A,WHITE STITCHED WALL CLOCK,0.796,9
17013D,21884,CAKES AND BOWS GIFT  TAPE,0.793,10
17013F,17014E,ORIGAMI OPIUM INCENSE CONES,0.9979,1
17013F,17014F,ORIGAMI SANDLEWOOD INCENSE CONES,0.9973,2
17013F,17011B,ORIGAMI JASMINE INCENSE+FLOWER,0.991,3
17013F,16008,SMALL FOLDING SCISSOR(POINTED EDGE),0.6785,4
17013F,17011A,ORIGAMI VANILLA INCENSE+FLOWER,0.6682,5
17013F,21520,BOOZE & WOMEN GREETING CARD,0.4105,6
17013F,23430,BLUE RETRO KITCHEN WALL CLOCK,0.3897,7
17013F,22614,PACK OF 12 SPACEBOY TISSUES,0.3588,8
17013F,23429,RED RETRO KITCHEN WALL CLOCK,0.3557,9
17013F,47504H,ENGLISH ROSE SPIRIT LEVEL,0.3491,10
17014A,17001,HEAVENS SCENT FRAGRANCE OILS ASSTD,0.6892,1
17014A,17012E,ORIGAMI OPIUM INCENSE/CANDLE SET,0.6851,2
17014A,17011C,ORIGAMI LAVENDER INCENSE+FLOWER,0.6623,3
17014A,17011E,ORIGAMI OPIUM SCENT INCENSE+FLOWER,0.6623,4
17014A,22864,MUG AND COASTER SET RED CIRCLES,0.6623,5
17014A,35822B,"ACRYLIC BEAD CHAIN, BLUE",0.6623,6
17014A,35822P,"ACRYLIC BEAD CHAIN, PINK",0.6623,7
17014A,79308B,MOSAIC CANDLE DISH BLUE PURPLE,0.6623,8
17014A,84857B,BLUE MONTE CARLO HANDBAG,0.6623,9
17014A,84908B,BLUE 5 PATCH FLOWER CUSHION COVER,0.6623,10
17014C,17013D,ORIGAMI ROSE INCENSE IN TUBE,0.2357,1
17014C,47504G,ENGLISH ROSE TAPE MEASURE,0.2012,2
17014C,21669,BLUE STRIPE CERAMIC DRAWER KNOB,0.148,3
17014C,21670,BLUE SPOT CERAMIC DRAWER KNOB,0.143,4
17014C,21673,WHITE SPOT BLUE CERAMIC DRAWER KNOB,0.1007,5
17014C,21671,RED SPOT CERAMIC DRAWER KNOB,0.0979,6
17014C,17038,PORCELAIN BUDAH INCENSE HOLDER,0.0956,7
17014C,21668,RED STRIPE CERAMIC DRAWER KNOB,0.0777,8
17014C,22410,MONEY BOX HOUSEKEEPING DESIGN,0.075,9
17014C,17021,NAMASTE SWAGAT INCENSE,0.0729,10
17014D,84797A,PINK HAWAIIAN PICNIC HAMPER FOR 4,0.825,1
17014D,84796A,PINK HAWAIIAN PICNIC HAMPER FOR 2,0.8149,2
17014D,84797B,BLUE SAVANNAH PICNIC HAMPER FOR 4,0.7284,3
17014D,84796B,BLUE SAVANNAH PICNIC HAMPER FOR 2,0.7042,4
17014D,17011D,ORIGAMI ROSE INCENSE+FLOWER,0.6946,5
17014D,21287,SCENTED VELVET LOUNGE CANDLE,0.6836,6
17014D,35637A,IVORY STRING CURTAIN WITH POLE,0.6767,7
17014D,17011C,ORIGAMI LAVENDER INCENSE+FLOWER,0.6726,8
17014D,17011E,ORIGAMI OPIUM SCENT INCENSE+FLOWER,0.6726,9
17014D,22864,MUG AND COASTER SET RED CIRCLES,0.6726,10
17014E,17014F,ORIGAMI SANDLEWOOD INCENSE CONES,0.9987,1
17014E,17013F,ORIGAMI SANDLEWOOD INCENSE IN TUBE,0.9979,2
17014E,17011B,ORIGAMI JASMINE INCENSE+FLOWER,0.9825,3
17014E,16008,SMALL FOLDING SCISSOR(POINTED EDGE),0.6794,4
17014E,17011A,ORIGAMI VANILLA INCENSE+FLOWER,0.6691,5
17014E,21520,BOOZE & WOMEN GREETING CARD,0.4067,6
17014E,23430,BLUE RETRO KITCHEN WALL CLOCK,0.3902,7
17014E,22614,PACK OF 12 SPACEBOY TISSUES,0.3593,8
17014E,23429,RED RETRO KITCHEN WALL CLOCK,0.3562,9
17014E,47504H,ENGLISH ROSE SPIRIT LEVEL,0.3496,10
17014F,17014E,ORIGAMI OPIUM INCENSE CONES,0.9987,1
17014F,17013F,ORIGAMI SANDLEWOOD INCENSE IN TUBE,0.9973,2
17014F,17011B,ORIGAMI JASMINE INCENSE+FLOWER,0.982,3
17014F,16008,SMALL FOLDING SCISSOR(POINTED EDGE),0.679,4
17014F,17011A,ORIGAMI VANILLA INCENSE+FLOWER,0.6687,5
17014F,21520,BOOZE & WOMEN GREETING CARD,0.4065,6
17014F,23430,BLUE RETRO KITCHEN WALL CLOCK,0.39,7
17014F,22614,PACK OF 12 SPACEBOY TISSUES,0.3607,8
17014F,23429,RED RETRO KITCHEN WALL CLOCK,0.356,9
17014F,47504H,ENGLISH ROSE SPIRIT LEVEL,0.3494,10
17021,72225D,VANILLA SCENT CAKE CANDLE,0.9208,1
17021,84631,FRUIT TREE AND BIRDS WALL PLAQUE,0.9163,2
17021,84869,CANDY BUTTON PHOTO ALBUM,0.9142,3
17021,37492B,BLUE YELLOW FLOWER PIGGY BANK,0.9133,4
17021,35637A,IVORY STRING CURTAIN WITH POLE,0.9128,5
17021,17011C,ORIGAMI LAVENDER INCENSE+FLOWER,0.9107,6
17021,17011E,ORIGAMI OPIUM SCENT INCENSE+FLOWER,0.9107,7
17021,22864,MUG AND COASTER SET RED CIRCLES,0.9107,8
17021,35822B,"ACRYLIC BEAD CHAIN, BLUE",0.9107,9
17021,35822P,"ACRYLIC BEAD CHAIN, PINK",0.9107,10
17027A,17039,INLAID WOOD INCENSE HOLDER,0.8873,1
17027A,17091A,LAVENDER INCENSE IN TIN,0.8171,2
17027A,17091J,VANILLA INCENSE IN TIN,0.802,3
17027A,10002,INFLATABLE POLITICAL GLOBE,0.0,4
17027A,10080,GROOVY CACTUS INFLATABLE,0.0,5
17027A,10109,BENDY COLOUR PENCILS,0.0,6
17027A,10120,DOGGY RUBBER,0.0,7
17027A,10123C,HEARTS WRAPPING TAPE,0.0,8
17027A,10123G,ARMY CAMO WRAPPING TAPE,0.0,9
17027A,10124A,SPOTS ON RED BOOKCOVER TAPE,0.0,10
17028J,17084J,LOVE POTION MASALA INCENSE,0.557,1
17028J,17084A,TRANQUILITY MASALA INCENSE,0.5553,2
17028J,35085E,IVORY ROSE LAMPSHADE,0.3542,3
17028J,21627,ELEPHANT CARNIVAL POUFFE,0.213,4
17028J,17084P,DRAGONS BLOOD INCENSE,0.1917,5
17028J,17084N,FAIRY DREAMS INCENSE,0.1865,6
17028J,40003,WHITE BAMBOO RIBS LAMPSHADE,0.1065,7
17028J,21167,WHITE SAGE INCENSE,0.1042,8
17028J,84795D,SEASIDE STRIPE HAMMOCK,0.0546,9
17028J,40001,WHITE BAMBOO RIBS LAMPSHADE,0.0503,10
17033,85184C,S/4 VALENTINE DECOUPAGE HEART BOX,0.3406,1
17033,72349B,SET/6 PURPLE BUTTERFLY T-LIGHTS,0.3017,2
17033,23373,VINTAGE CHRISTMAS PAPER GIFT BAG,0.2689,3
17033,23111,PARISIENNE SEWING BOX,0.2416,4
17033,37462B,"PET MUG, BUDGIE",0.2227,5
17033,22407,MONEY BOX FIRST ADE DESIGN,0.205,6
17033,21199,PINK  HEART CONFETTI IN TUBE,0.2047,7
17033,23456,MEDIUM PARLOUR PICTURE FRAME,0.1987,8
17033,21632,VINTAGE PINK DECORATIVE PARASOL,0.1782,9
17033,16015,MEDIUM CHINESE STYLE SCISSOR,0.1762,10
17038,84952C,MIRROR LOVE BIRD T-LIGHT HOLDER,0.7212,1
17038,84952B,BLACK LOVE BIRD T-LIGHT HOLDER,0.7184,2
17038,37461,FUNKY MONKEY MUG,0.6993,3
17038,23509,MINI PLAYING CARDS FUN FAIR,0.6857,4
17038,84387A,BIRD ON BRANCH CANVAS SCREEN,0.669,5
17038,85040B,SET/4 BLUE FLOWER CANDLES IN BOWL,0.6686,6
17038,75178,ASSTD COL BUTTERFLY/CRYSTAL W/CHIME,0.6684,7
17038,84692,BOX OF 24 COCKTAIL PARASOLS,0.6672,8
17038,84858A,NATURAL RIVIERA HANDBAG,0.6645,9
17038,72793,BLACK BOX MIRROR LANTERN,0.6634,10
17039,17027A,INCENSE BAZAAR CANNABIS,0.8873,1
17039,17091J,VANILLA INCENSE IN TIN,0.8022,2
17039,17091A,LAVENDER INCENSE IN TIN,0.787,3
17039,37345,ASSTD HEARTS DESIGN MUGS,0.4528,4
17039,20913,SET/5 BLUE SPOTTY LID GLASS BOWLS,0.4492,5
17039,20715,LITTLE FLOWER SHOPPER BAG,0.447,6
17039,84798A,PINK FOXGLOVE ARTIIFCIAL FLOWER,0.4439,7
17039,23046,PAPER LANTERN 9 POINT DELUXE STAR,0.4436,8
17039,21438,TUB 24 HANGING EASTER EGGS SPOTTY,0.4407,9
17039,22936,BAKING MOULD ROSE WHITE CHOCOLATE,0.4396,10
17061,84371,BIG PINK POODLE,0.9819,1
17061,72739C,DARK CHOCOLATE SCENTCANDLE,0.8919,2
17061,72739B,WHITE CHOCOLATE SCENT CANDLE,0.8682,3
17061,35271S,GOLD PRINT PAPER BAG,0.8477,4
17061,22657,HEN & 2 CHICKS IN BASKET,0.8049,5
17061,84227,HEN HOUSE W CHICK IN NEST,0.7924,6
17061,72750D,F.FAIRY S/3 CANDLE/GLASS,0.7464,7
17061,84206A,3 BLACK CATS W HEARTS BLANK CARD,0.7375,8
17061,17084G,MOON INCENSE,0.7071,9
17061,35633B,BLUE TINSEL GARLAND,0.6502,10
17084A,17084J,LOVE POTION MASALA INCENSE,0.6007,1
17084A,17028J,INCENSE BAZAAR PEACH,0.5553,2
17084A,71434B,"BLACK RND BULLET""KEEP CLEAN"" BIN",0.459,3
17084A,21167,WHITE SAGE INCENSE,0.2823,4
17084A,72024U,LILAC VOTIVE CANDLE,0.2763,5
17084A,35001B,HAND OPEN SHAPE BLACK,0.2716,6
17084A,84746,PINK EASTER HENS+FLOWER,0.2473,7
17084A,17084N,FAIRY DREAMS INCENSE,0.2427,8
17084A,84865,NEW BAROQUE BLACK PHOTO ALBUM,0.2397,9
17084A,35085E,IVORY ROSE LAMPSHADE,0.1967,10
17084G,17061,ASSORTED SHAPED STENCIL FOR HENNA,0.7071,1
17084G,47569,ENGLISH ROSE DESIGN SHOPPING BAG,0.7071,2
17084G,84371,BIG PINK POODLE,0.6943,3
17084G,72739C,DARK CHOCOLATE SCENTCANDLE,0.6306,4
17084G,72739B,WHITE CHOCOLATE SCENT CANDLE,0.6139,5
17084G,35271S,GOLD PRINT PAPER BAG,0.5994,6
17084G,22657,HEN & 2 CHICKS IN BASKET,0.5692,7
17084G,84227,HEN HOUSE W CHICK IN NEST,0.5603,8
17084G,72750D,F.FAIRY S/3 CANDLE/GLASS,0.5278,9
17084G,84206A,3 BLACK CATS W HEARTS BLANK CARD,0.5215,10
17084J,17084A,TRANQUILITY MASALA INCENSE,0.6007,1
17084J,17028J,INCENSE BAZAAR PEACH,0.557,2
17084J,84292B,BLUE COL METAL FOLDING CHAIR,0.3407,3
17084J,90175B,PINK GLASS CHUNKY CHARM BRACELET,0.29,4
17084J,17084P,DRAGONS BLOOD INCENSE,0.284,5
17084J,90179A,AMBER FINE BEAD NECKLACE W TASSEL,0.2785,6
17084J,90156,RESIN BRACELET W PASTEL BEADS,0.2742,7
17084J,90065A,WHITE VINTAGE CRYSTAL BRACELET,0.2644,8
17084J,17084N,FAIRY DREAMS INCENSE,0.2634,9
17084J,90078,PINK/WHITE GLASS DEMI CHOKER,0.2626,10
17084N,17084P,DRAGONS BLOOD INCENSE,0.6611,1
17084N,71510,SQUARE METAL CANDLEHOLDER BASE,0.6359,2
17084N,85230G,ORANGE VOTIVE CANDLE,0.6175,3
17084N,72134,COLUMBIAN  CUBE CANDLE,0.6112,4
17084N,84387A,BIRD ON BRANCH CANVAS SCREEN,0.606,5
17084N,85230E,STRAWBRY SCENTED VOTIVE CANDLE,0.6056,6
17084N,75178,ASSTD COL BUTTERFLY/CRYSTAL W/CHIME,0.6054,7
17084N,44236,PINK/PURPLE CIRCLE CURTAIN,0.6047,8
17084N,84858A,NATURAL RIVIERA HANDBAG,0.6019,9
17084N,72793,BLACK BOX MIRROR LANTERN,0.601,10
17084P,84387A,BIRD ON BRANCH CANVAS SCREEN,0.7668,1
17084P,75178,ASSTD COL BUTTERFLY/CRYSTAL W/CHIME,0.7662,2
17084P,72793,BLACK BOX MIRROR LANTERN,0.7647,3
17084P,84858A,NATURAL RIVIERA HANDBAG,0.7616,4
17084P,90125C,TURQUOISE BERTIE GLASS BEAD CHARM,0.756,5
17084P,35598D,PINK/WHITE CHRISTMAS TREE 60CM,0.7541,6
17084P,71510,SQUARE METAL CANDLEHOLDER BASE,0.7535,7
17084P,90125D,PURPLE BERTIE GLASS BEAD BAG CHARM,0.7513,8
17084P,16168S,FUNKY MONKEY GIFT BAG SMALL,0.75,9
17084P,21065,BOOM BOX SPEAKER GIRLS,0.75,10
17084R,84798B,PURPLE FOXGLOVE ARTIIFCIAL FLOWER,0.9048,1
17084R,20715,LITTLE FLOWER SHOPPER BAG,0.8733,2
17084R,37345,ASSTD HEARTS DESIGN MUGS,0.8697,3
17084R,20913,SET/5 BLUE SPOTTY LID GLASS BOWLS,0.8693,4
17084R,84798A,PINK FOXGLOVE ARTIIFCIAL FLOWER,0.8689,5
17084R,23046,PAPER LANTERN 9 POINT DELUXE STAR,0.8668,6
17084R,22936,BAKING MOULD ROSE WHITE CHOCOLATE,0.8646,7
17084R,21438,TUB 24 HANGING EASTER EGGS SPOTTY,0.861,8
17084R,21903,MAN FLU METAL SIGN,0.8575,9
17084R,21477,STRING OF 20 ROSE LIGHTS,0.8567,10
17090A,20715,LITTLE FLOWER SHOPPER BAG,0.8467,1
17090A,37345,ASSTD HEARTS DESIGN MUGS,0.8433,2
17090A,20913,SET/5 BLUE SPOTTY LID GLASS BOWLS,0.8428,3
17090A,23046,PAPER LANTERN 9 POINT DELUXE STAR,0.8414,4
17090A,84798A,PINK FOXGLOVE ARTIIFCIAL FLOWER,0.8406,5
17090A,22936,BAKING MOULD ROSE WHITE CHOCOLATE,0.8365,6
17090A,21438,TUB 24 HANGING EASTER EGGS SPOTTY,0.8347,7
17090A,21477,STRING OF 20 ROSE LIGHTS,0.8298,8
17090A,23040,PAPER LANTERN 9 POINT SNOW STAR,0.8265,9
17090A,84522,PINK PARTY SUNGLASSES,0.8248,10
17090D,20683,RAIN GIRL CHILDS UMBRELLA,0.5124,1
17090D,35976B,WHITE SCANDINAVIAN HEART CHRISTMAS,0.5124,2
17090D,17084P,DRAGONS BLOOD INCENSE,0.4551,3
17090D,85129B,BEADED CRYSTAL HEART GREEN SMALL,0.4394,4
17090D,85170B,SET/6 BLACK BIRD T-LIGHT CANDLES,0.4231,5
17090D,35598D,PINK/WHITE CHRISTMAS TREE 60CM,0.4163,6
17090D,75178,ASSTD COL BUTTERFLY/CRYSTAL W/CHIME,0.4119,7
17090D,84387A,BIRD ON BRANCH CANVAS SCREEN,0.4099,8
17090D,35598B,BLACK CHRISTMAS TREE 60CM,0.4082,9
17090D,84858A,NATURAL RIVIERA HANDBAG,0.4071,10
17091A,17091J,VANILLA INCENSE IN TIN,0.9224,1
17091A,17027A,INCENSE BAZAAR CANNABIS,0.8171,2
17091A,17039,INLAID WOOD INCENSE HOLDER,0.787,3
17091A,17012A,ORIGAMI VANILLA INCENSE/CANDLE SET,0.4049,4
17091A,17013C,ORIGAMI LAVENDER INCENSE IN TUBE,0.4024,5
17091A,84509E,CAROUSEL PLACEMATS,0.397,6
17091A,84720,DOT MATRIX CANVAS ART PICTURE,0.3961,7
17091A,84660A,WHITE STITCHED WALL CLOCK,0.3953,8
17091A,85170C,SET/6 EAU DE NIL BIRD T-LIGHTS,0.3939,9
17091A,22104,MIRROR MOSAIC CANDLE PLATE,0.393,10
17091B,20715,LITTLE FLOWER SHOPPER BAG,0.4557,1
17091B,84219,BOX/12 MOTHER & CHICK IN BASKET/BOW,0.4545,2
17091B,37345,ASSTD HEARTS DESIGN MUGS,0.4538,3
17091B,20913,SET/5 BLUE SPOTTY LID GLASS BOWLS,0.4536,4
17091B,23046,PAPER LANTERN 9 POINT DELUXE STAR,0.4527,5
17091B,84798A,PINK FOXGLOVE ARTIIFCIAL FLOWER,0.4524,6
17091B,21438,TUB 24 HANGING EASTER EGGS SPOTTY,0.4493,7
17091B,22936,BAKING MOULD ROSE WHITE CHOCOLATE,0.4471,8
17091B,21477,STRING OF 20 ROSE LIGHTS,0.4466,9
17091B,23040,PAPER LANTERN 9 POINT SNOW STAR,0.4448,10
17091F,90020,FILIGREE DIAMANTE CHAIN,0.2491,1
17091F,72715,SPHERICAL IVORY CANDLE,0.2271,2
17091F,16169F,WRAP BLIZZARD,0.2251,3
17091F,21038,SET/4 MODERN VINTAGE COTTON NAPKINS,0.211,4
17091F,85040A,S/4 PINK FLOWER CANDLES IN BOWL,0.1687,5
17091F,84803B,WHITE ALLIUM  ARTIFICIAL FLOWER,0.1471,6
17091F,90081A,LILY BROOCH AMETHYST COLOUR,0.1449,7
17091F,35936,CERISE+GOLD CHRISTMAS TREE DEC,0.1416,8
17091F,23491,VINTAGE JINGLE BELLS HEART,0.1407,9
17091F,90196B,BLACK GEMSTONE NECKLACE 45CM,0.1351,10
17091J,17091A,LAVENDER INCENSE IN TIN,0.9224,1
17091J,17039,INLAID WOOD INCENSE HOLDER,0.8022,2
17091J,17027A,INCENSE BAZAAR CANNABIS,0.802,3
17091J,84805B,BLUE CLIMBING HYDRANGA ART FLOWER,0.3254,4
17091J,84798B,PURPLE FOXGLOVE ARTIIFCIAL FLOWER,0.3104,5
17091J,72130,COLUMBIAN CANDLE ROUND,0.3066,6
17091J,17012A,ORIGAMI VANILLA INCENSE/CANDLE SET,0.2946,7
17091J,72128,COLUMBIAN CANDLE ROUND,0.2943,8
17091J,72131,COLUMBIAN CANDLE RECTANGLE,0.2936,9
17091J,84660A,WHITE STITCHED WALL CLOCK,0.2909,10
17096,35160,BUDDHA INCENSE HOLDER ASSORTED,0.8081,1
17096,84720,DOT MATRIX CANVAS ART PICTURE,0.1571,2
17096,17013C,ORIGAMI LAVENDER INCENSE IN TUBE,0.1571,3
17096,16207B,PINK HEART RED HANDBAG,0.156,4
17096,84509E,CAROUSEL PLACEMATS,0.155,5
17096,22104,MIRROR MOSAIC CANDLE PLATE,0.1528,6
17096,21040,MODERN VINTAGE COTTON SHOPPING BAG,0.1512,7
17096,84660A,WHITE STITCHED WALL CLOCK,0.1504,8
17096,75011,BLUE DAISY MOBILE,0.1504,9
17096,72225C,LAVENDER SCENT CAKE CANDLE,0.1501,10
17107D,90001D,ANTIQUE OLIVE GREEN FLOWER EARRINGS,0.519,1
17107D,81950V,FLOWER PURPLE CLOCK W/SUCKER,0.4561,2
17107D,47597,NEW ENGLAND TEATOWELS,0.4549,3
17107D,90000D,COPPER/OLIVE GREEN FLOWER NECKLACE,0.4401,4
17107D,84629,WHITE 3 FRAME BIRDS AND TREE,0.3822,5
17107D,20899,VINTAGE NOTEBOOK RED ROSE,0.3768,6
17107D,40046C,PINK BUTTERFLY PAPER LAMPSHADE,0.3262,7
17107D,84247N,PACK/12 BLUE FOLKART CARDS,0.318,8
17107D,20906,VINTAGE NOTEBOOK BEAUTY GIRL,0.3148,9
17107D,21018,BIRD BOX CHRISTMAS TREE DECORATION,0.2873,10
17108D,90086,CRYSTAL FROG PHONE CHARM,0.4694,1
17108D,22395,PAPERWEIGHT VINTAGE PAISLEY,0.4576,2
17108D,90087,CRYSTAL SEA HORSE PHONE CHARM,0.3734,3
17108D,17012D,ORIGAMI ROSE INCENSE/CANDLE SET,0.368,4
17108D,35651,VINTAGE BEAD PINK SCARF,0.3244,5
17108D,90035B,"PEARL & SHELL 42""NECKL. PINK",0.2901,6
17108D,72789,BASKET/8 SCENTED LOVE TOKEN CANDLES,0.2865,7
17108D,90035C,"PEARL & SHELL 42""NECKL. IVORY",0.2813,8
17108D,17090D,VANILLA INCENSE 40 CONES IN TIN,0.2791,9
17108D,72800E,4 IVORY DINNER CANDLES SILVER FLOCK,0.2636,10
17109A,84631,FRUIT TREE AND BIRDS WALL PLAQUE,0.9738,1
17109A,72754A,FLOWER FAIRY POTPOURRI CUSHION LILY,0.9731,2
17109A,84601A,NEW BAROQUE IVORY CUSHION COVER,0.968,3
17109A,84869,CANDY BUTTON PHOTO ALBUM,0.968,4
17109A,37492B,BLUE YELLOW FLOWER PIGGY BANK,0.9658,5
17109A,72753B,S/3 FLWR FAIRY LAVENDER CANDLES,0.9621,6
17109A,17011C,ORIGAMI LAVENDER INCENSE+FLOWER,0.9612,7
17109A,17011E,ORIGAMI OPIUM SCENT INCENSE+FLOWER,0.9612,8
17109A,22864,MUG AND COASTER SET RED CIRCLES,0.9612,9
17109A,35822B,"ACRYLIC BEAD CHAIN, BLUE",0.9612,10
17109B,17109C,FLOWER FAIRY INCENSE ROSE,0.9985,1
17109B,37379B,BLUE CHERRY BLOSSOM CUP & SAUCER,0.9963,2
17109B,37351,ORANGE FLOWER MUG,0.9962,3
17109B,20800,LARGE GLASS SUNDAE DISH CLEAR,0.9962,4
